GILD,73,333 Lakeside Drive,Foster City,CA,94404,United States,650 574 3000,https://www.gilead.com,Drug Manufacturers - General,drug-manufacturers-general,Drug Manufacturers - General,Healthcare,healthcare,Healthcare,"Gilead Sciences, Inc., a biopharmaceutical company, discovers, develops, and commercializes medicines in the areas of unmet medical need in the United States, Europe, and internationally. The company provides Biktarvy, Genvoya, Descovy, Odefsey, Truvada, Complera/ Eviplera, Stribild, Sunlencs, and Atripla products for the treatment of HIV/AIDS; Veklury, an injection for intravenous use, for the treatment of COVID-19; and Epclusa, Harvoni, Vemlidy, and Viread for the treatment of viral hepatitis. It also offers Yescarta, Tecartus, and Trodelvy products for the treatment of oncology; Letairis, an oral formulation for the treatment of pulmonary arterial hypertension; and AmBisome, a liposomal formulation for the treatment of serious invasive fungal infections. The company has collaboration agreements with Arcus Biosciences, Inc.; Merck Sharp & Dohme Corp.; Pionyr Immunotherapeutics Inc.; Tizona Therapeutics, Inc.; Galapagos NV; Janssen Sciences Ireland Unlimited Company; Japan Tobacco, Inc.; Dragonfly Therapeutics, Inc.; Arcellx, Inc.; Everest Medicines; Merck & Co, Inc.; Tentarix Biotherapeutics Inc.; Marengo Therapeutics; and Assembly Biosciences, Inc. It also has research collaboration, option, and license agreement with Merus N.V. for the discovery of novel dual tumor-associated antigens (TAA) targeting trispecific antibodies. The company has a collaboration with Terray Therapeutics, Inc. to discover and develop small molecule therapies; and LEO Pharma to develop, manufacture, and commercialize the small molecule oral STAT6 program. The company was incorporated in 1987 and is headquartered in Foster City, California.",17600,"[{'maxAge': 1, 'name': ""Mr. Daniel P.  O'Day"", 'age': 59, 'title': 'Chairman & CEO', 'yearBorn': 1965, 'fiscalYear': 2024, 'totalPay': 7137565, 'exercisedValue': 0, 'unexercisedValue': 30103994}, {'maxAge': 1, 'name': 'Mr. Andrew D. Dickinson', 'age': 54, 'title': 'Chief Financial Officer', 'yearBorn': 1970, 'fiscalYear': 2024, 'totalPay': 2729705, 'exercisedValue': 5536695, 'unexercisedValue': 8763160}, {'maxAge': 1, 'name': 'Ms. Deborah H. Telman J.D.', 'age': 59, 'title': 'Executive VP of Corporate Affairs, General Counsel & Corporate Secretary', 'yearBorn': 1965, 'fiscalYear': 2024, 'totalPay': 3107954, 'exercisedValue': 0, 'unexercisedValue': 1127163}, {'maxAge': 1, 'name': 'Ms. Johanna  Mercier', 'age': 54, 'title': 'Chief Commercial Officer', 'yearBorn': 1970, 'fiscalYear': 2024, 'totalPay': 3169442, 'exercisedValue': 0, 'unexercisedValue': 12195903}, {'maxAge': 1, 'name': 'Ms. Diane E. Wilfong', 'age': 62, 'title': 'Interim Corporate Controller, Chief Accounting Officer & Principal Accounting Officer', 'yearBorn': 1962, 'fiscalYear': 2024, 'exercisedValue': 0, 'unexercisedValue': 0}, {'maxAge': 1, 'name': 'Ms. Jacquie  Ross C.F.A.', 'title': 'Senior Vice President of Treasury and Investor Relations', 'fiscalYear': 2024, 'exercisedValue': 0, 'unexercisedValue': 0}, {'maxAge': 1, 'name': 'Ms. Jyoti K. Mehra', 'age': 47, 'title': 'Executive Vice President of Human Resources', 'yearBorn': 1977, 'fiscalYear': 2024, 'exercisedValue': 0, 'unexercisedValue': 0}, {'maxAge': 1, 'name': 'Dr. Linda Slanec Higgins Ph.D.', 'age': 62, 'title': 'Senior Vice President of Research, Innovation & Portfolio', 'yearBorn': 1962, 'fiscalYear': 2024, 'exercisedValue': 0, 'unexercisedValue': 0}, {'maxAge': 1, 'name': 'Dr. Flavius  Martin M.D.', 'title': 'Executive Vice President of Research', 'fiscalYear': 2024, 'exercisedValue': 0, 'unexercisedValue': 0}, {'maxAge': 1, 'name': 'Ms. Janet  Dorling', 'age': 49, 'title': 'Senior Vice President of Intercontinental Region & Global Patient Solutions', 'yearBorn': 1975, 'fiscalYear': 2024, 'exercisedValue': 0, 'unexercisedValue': 0}]",9,5,4,2,3,1756684800,1735603200,http://investors.gilead.com/phoenix.zhtml?c=69964&p=irol-irhome,[],86400,2,112.54,113.22,110.16,114.13,112.54,113.22,110.16,114.13,3.16,2.81,1757894400,0.619,3.91,0.379,22.305836,14.920592,5438539,5438539,6803922,6903070,6903070,110.72,116.93,1,1,1.40E+11,81.83,121.83,4.8380404,114.0292,105.67645,3.12,0.027723474,USD,FALSE,1.58E+11,0.21865,1238163997,1240809984,17562109,19990775,1753920000,1756425600,0.014199999,0.001,0.90744,2.79,0.014199999,1259609984,15.841,6.998296,1735603200,1767139200,1751241600,0.214,6311000064,4.97,7.43,2:01,1359331200,5.49,11.481,0.35508728,0.17405021,0.79,1757894400,EQUITY,110.86,145,98,125.1936,128,1.71429,buy,25,6057999872,4.882,13800999936,24945999872,0.969,1.315,28863000576,127.34,23.155,0.12616,0.33403,22666999808,8835000320,9868000256,0.209,0.018,0.78533,0.47816002,0.39156,USD,GILD,en-US,US,Equity,Nasdaq Real Time Price,TRUE,HIGH,POST,0.26159203,111.15,0.29000092,-1.6800003,110.16 - 114.13,NasdaqGS,6803922,29.029999,0.35475984,81.83 - 121.83,-10.970001,-0.090043515,35.508728,1759104000,1754596800,"[{'header': 'Dividend', 'message': 'GILD announced a cash dividend of 0.79 with an ex-date of Sep. 15, 2025', 'meta': {'eventType': 'DIVIDEND', 'dateEpochMs': 1757908800000, 'amount': '0.79'}}]",1758065307,1758052801,NMS,finmb_29002,America/New_York,EDT,-14400000,us_market,FALSE,-1.4928029,110.86,"Gilead Sciences, Inc.","Gilead Sciences, Inc.",1762372800,1762372800,1754598600,1754598600,TRUE,4.97,7.43,8.10062,13.685371,-3.169197,-0.027792856,5.183548,0.049051117,15,0,,TRUE,6.96E+11,,1.7 - Buy,FALSE,Gilead Sciences,0.2117,,,650 578 9264,
SYK,74,1941 Stryker Way,Portage,MI,49002,United States,(269) 385-2600,https://www.stryker.com,Medical Devices,medical-devices,Medical Devices,Healthcare,healthcare,Healthcare,"Stryker Corporation operates as a medical technology company. It operates through two segments, MedSurg and Neurotechnology, and Orthopaedics. The MedSurg and Neurotechnology segment offers surgical equipment, and surgical navigation systems, endoscopic and communications systems, patient handling, emergency medical equipment and intensive care disposable products, clinical communication and  artificial intelligence-assisted virtual care platform technology, minimally invasive products for the treatment of acute ischemic and hemorrhagic stroke, cranial, and maxillofacial and chest wall devices, as well as dural substitutes and sealants; traditional brain and open skull based surgical procedures products; and orthobiologic and biosurgery products, including synthetic bone grafts and vertebral augmentation products. The Orthopaedics segment provides implants for use in total joint replacements, such as hip, knee and shoulder, and trauma and extremities surgeries; thoracolumbar systems that include fixation, minimally invasive and interbody systems used in spinal injury, complex spine and degenerative therapies. The company sells its products to doctors, hospitals, and other healthcare facilities through company-owned subsidiaries and branches, as well as third-party dealers and distributors in approximately 75 countries. Stryker Corporation was founded in 1941 and is headquartered in Portage, Michigan.",53000,"[{'maxAge': 1, 'name': 'Mr. Kevin A. Lobo', 'age': 59, 'title': 'Chairman, CEO & President', 'yearBorn': 1965, 'fiscalYear': 2024, 'totalPay': 5275782, 'exercisedValue': 43295364, 'unexercisedValue': 191882304}, {'maxAge': 1, 'name': 'Mr. Viju S. Menon', 'age': 56, 'title': 'Group President of Global Quality & Operations', 'yearBorn': 1968, 'fiscalYear': 2024, 'totalPay': 1567937, 'exercisedValue': 0, 'unexercisedValue': 19779564}, {'maxAge': 1, 'name': 'Mr. Glenn S. Boehnlein CPA', 'age': 62, 'title': 'Advisor', 'yearBorn': 1962, 'fiscalYear': 2024, 'totalPay': 2111081, 'exercisedValue': 19827876, 'unexercisedValue': 26137546}, {'maxAge': 1, 'name': 'Mr. J. Andrew Pierce', 'age': 50, 'title': 'Group President of MedSurg & Neurotechnology', 'yearBorn': 1974, 'fiscalYear': 2024, 'totalPay': 1879020, 'exercisedValue': 2370905, 'unexercisedValue': 22463508}, {'maxAge': 1, 'name': 'Mr. Spencer S. Stiles', 'age': 47, 'title': 'Group President of Orthopaedics & Spine', 'yearBorn': 1977, 'fiscalYear': 2024, 'totalPay': 1879020, 'exercisedValue': 0, 'unexercisedValue': 22665086}, {'maxAge': 1, 'name': 'Mr. Preston  Wells', 'title': 'VP & CFO', 'fiscalYear': 2024, 'exercisedValue': 0, 'unexercisedValue': 0}, {'maxAge': 1, 'name': 'Mr. William E. Berry Jr.', 'age': 58, 'title': 'VP & Chief Accounting Officer', 'yearBorn': 1966, 'fiscalYear': 2024, 'exercisedValue': 0, 'unexercisedValue': 0}, {'maxAge': 1, 'name': 'Mr. Robert C. Cohen', 'title': 'CTO and VP of Global R&D - Joint Replacement', 'fiscalYear': 2024, 'exercisedValue': 0, 'unexercisedValue': 0}, {'maxAge': 1, 'name': 'Mr. Alan  Douville', 'title': 'VP, Chief Information Officer & Chief Information Security Officer', 'fiscalYear': 2024, 'exercisedValue': 0, 'unexercisedValue': 0}, {'maxAge': 1, 'name': 'Mr. Jason  Beach', 'title': 'Vice President of Finance & Investor Relations', 'fiscalYear': 2024, 'exercisedValue': 0, 'unexercisedValue': 0}]",8,9,1,6,7,1756684800,1735603200,http://phx.corporate-ir.net/phoenix.zhtml?c=118965&p=irol-irhome,[],86400,2,377.11,375.49,375,378.53,377.11,375.49,375,378.53,3.36,0.89,1759190400,0.4397,1,0.932,49.9496,27.83592,1234874,1234874,1220480,967380,967380,377.25,376.45,3,5,1.44E+11,329.16,406.19,6.045195,388.6866,380.24194,3.32,0.008803798,USD,FALSE,1.59E+11,0.12251,344604152,382307008,4185083,4906611,1753920000,1756425600,0.0109,0.053590003,0.81685996,3.3,0.0115,382307008,55.429,6.794638,1735603200,1767139200,1751241600,0.072,2918000128,7.54,13.53,2:01,1084752000,6.661,24.835,0.0361588,0.17405021,0.84,1751241600,EQUITY,376.62,465,316,433.19232,439,1.86667,buy,26,2464000000,6.445,6387999744,17127999488,0.876,1.784,23818000384,80.827,62.408,0.07735,0.1425,15470000128,3489499904,4766000128,0.07,0.111,0.64950997,0.2682,0.21952999,USD,SYK,en-US,US,Equity,Nasdaq Real Time Price,TRUE,HIGH,POST,0.10089876,377,0.38000488,-0.48999,375.0 - 378.53,NYSE,1220480,47.45999,0.14418517,329.16 - 406.19,-29.570007,-0.07279846,3.61588,1761868800,1753992000,"[{'header': 'Dividend', 'message': 'SYK announced a cash dividend of 0.84 with an ex-date of Sep. 30, 2025', 'meta': {'eventType': 'DIVIDEND', 'dateEpochMs': 1759204800000, 'amount': '0.84'}}]",1758065521,1758052802,NYQ,finmb_94614,America/New_York,EDT,-14400000,us_market,FALSE,-0.129933,376.62,Stryker Corporation,Stryker Corporation,1761681600,1761681600,1753993800,1753993800,TRUE,7.54,13.53,13.49411,27.909954,-12.06662,-0.031044599,-3.6219482,-0.009525378,15,0,,TRUE,3.22E+11,,1.9 - Buy,FALSE,Stryker,1.9185,,,(269) 385-1062,
PGR,75,300 North Commons Blvd.,Mayfield,OH,44143,United States,440 461 5000,https://www.progressive.com,Insurance - Property & Casualty,insurance-property-casualty,Insurance - Property & Casualty,Financial Services,financial-services,Financial Services,"The Progressive Corporation operates as an insurance company in the United States. The company writes insurance for personal autos and special lines products, including motorcycles, RVs, and watercraft; and personal residential property insurance for homeowners and renters. It also writes auto-related liability and physical damage insurance for comprising dump trucks, log trucks, garbage trucks, tractors, trailers, straight trucks, tow trucks and wreckers, vans, pick-up trucks, and autos; business-related general liability and commercial property insurance for small businesses; and workers' compensation insurance for the transportation industry. In addition, the company offers other specialty property-casualty insurance and provide related services; personal property reinsurance products; and involved in investment activities. It sells its products through independent insurance agencies, as well as online and over the phone. The Progressive Corporation was founded in 1937 and is headquartered in Mayfield Village, Ohio.",66308,"[{'maxAge': 1, 'name': 'Ms. Susan Patricia Griffith', 'age': 60, 'title': 'President, CEO & Director', 'yearBorn': 1964, 'fiscalYear': 2024, 'totalPay': 5877386, 'exercisedValue': 0, 'unexercisedValue': 0}, {'maxAge': 1, 'name': 'Mr. John Peter Sauerland', 'age': 60, 'title': 'VP & CFO', 'yearBorn': 1964, 'fiscalYear': 2024, 'totalPay': 2694629, 'exercisedValue': 0, 'unexercisedValue': 0}, {'maxAge': 1, 'name': 'Mr. Patrick K. Callahan', 'age': 54, 'title': 'President of Personal Lines', 'yearBorn': 1970, 'fiscalYear': 2024, 'totalPay': 2494896, 'exercisedValue': 0, 'unexercisedValue': 0}, {'maxAge': 1, 'name': 'Mr. John Joseph Murphy', 'age': 55, 'title': 'President of Claims', 'yearBorn': 1969, 'fiscalYear': 2024, 'totalPay': 1685882, 'exercisedValue': 0, 'unexercisedValue': 0}, {'maxAge': 1, 'name': 'Ms. Karen Barone Bailo', 'age': 56, 'title': 'President of Commercial Lines', 'yearBorn': 1968, 'fiscalYear': 2024, 'totalPay': 2061116, 'exercisedValue': 0, 'unexercisedValue': 0}, {'maxAge': 1, 'name': 'Mr. Jonathan S. Bauer', 'age': 46, 'title': 'Chief Investment Officer', 'yearBorn': 1978, 'fiscalYear': 2024, 'exercisedValue': 0, 'unexercisedValue': 0}, {'maxAge': 1, 'name': 'Mr. Carl G. Joyce', 'age': 42, 'title': 'Vice President & Chief Accounting Officer', 'yearBorn': 1982, 'fiscalYear': 2024, 'exercisedValue': 0, 'unexercisedValue': 0}, {'maxAge': 1, 'name': 'Mr. Steven Anthony Broz', 'age': 54, 'title': 'Chief Information Officer', 'yearBorn': 1970, 'fiscalYear': 2024, 'exercisedValue': 0, 'unexercisedValue': 0}, {'maxAge': 1, 'name': 'Mr. Douglas S. Constantine', 'title': 'Director of Investor Relations', 'fiscalYear': 2024, 'exercisedValue': 0, 'unexercisedValue': 0}, {'maxAge': 1, 'name': 'Mr. David M. Stringer', 'age': 49, 'title': 'VP, Secretary & Chief Legal Officer', 'yearBorn': 1975, 'fiscalYear': 2024, 'exercisedValue': 0, 'unexercisedValue': 0}]",6,2,3,7,3,1756684800,1735603200,http://investors.progressive.com/phoenix.zhtml?c=81824&p=irol-irhome,[],86400,2,245.65,243.72,241.03,245.56,245.65,243.72,241.03,245.56,4.9,1.99,1759363200,0.2761,1.67,0.325,13.793356,17.75145,2180374,2180374,3439719,2346610,2346610,242.71,245,1,2,1.44E+11,228.54,292.99,1.7438381,246.4776,260.33606,4.9,0.01994708,USD,FALSE,1.48E+11,0.12663999,583951584,586400000,6223821,7027894,1753920000,1756425600,0.0106,0.00261,0.8801,2.1,0.0106,592678016,55.618,4.4045095,1735603200,1767139200,1751241600,1.176,10432000000,17.76,13.8,4:01,1147996800,1.8,10.819,-0.043828607,0.17405021,0.1,1751500800,EQUITY,244.97,347,189,283.8889,280,2.18182,buy,18,2228000000,3.801,13704999936,6895000064,0.248,0.317,82375999488,21.148,140.609,0.07856,0.37293997,13905000448,13717175296,16800000000,1.177,0.213,0.1688,0.16636999,0.18417999,USD,PGR,en-US,US,Equity,Nasdaq Real Time Price,TRUE,HIGH,POST,-0.0489836,244.85,-0.119995,-0.679993,241.03 - 245.56,NYSE,3439719,16.430008,0.07189117,228.54 - 292.99,-48.01999,-0.16389635,-4.3828607,1760054400,1750249480,"[{'header': 'Dividend', 'message': 'PGR announced a cash dividend of 0.10 with an ex-date of Oct. 2, 2025', 'meta': {'eventType': 'DIVIDEND', 'dateEpochMs': 1759377600000, 'amount': '0.10'}}]",1758064694,1758052802,NYQ,finmb_33352,America/New_York,EDT,-14400000,us_market,FALSE,-0.276814,244.97,Progressive Corporation (The),The Progressive Corporation,1754310600,1754656200,1746538200,1746538200,FALSE,17.76,13.8,17.65427,13.875963,-1.5075989,-0.006116576,-15.366058,-0.059023935,15,0,,TRUE,3.22E+11,,2.2 - Buy,FALSE,The Progressive,5.3612,,,,
PFE,76,66 Hudson Boulevard East,New York,NY,10001-2192,United States,212 733 2323,https://www.pfizer.com,Drug Manufacturers - General,drug-manufacturers-general,Drug Manufacturers - General,Healthcare,healthcare,Healthcare,"Pfizer Inc. discovers, develops, manufactures, markets, distributes, and sells biopharmaceutical products in the United States and internationally. The company offers medicines and vaccines in various therapeutic areas, including cardiovascular and migraine under the Eliquis, Nurtec ODT/Vydura, Zavzpret, and the Premarin family brands; infectious diseases with unmet medical needs under the Prevnar family, Abrysvo, Nimenrix, FSME/IMMUN-TicoVac, and Trumenba brands; and COVID-19 prevention and treatment, and potential future mRNA and antiviral products under the Comirnaty and Paxlovid brands. It also provides medicines and vaccines in various therapeutic areas, such as biosimilars for chronic immune and inflammatory diseases under the Xeljanz, Enbrel, Inflectra, Litfulo, Velsipity, and Cibinqo brands; amyloidosis, hemophilia, endocrine diseases, and sickle cell disease under the Vyndaqel family, Oxbryta, BeneFIX, Somavert, Ngenla, and Genotropin brands; sterile injectable and anti-infective medicines under the Sulperazon, Medrol, Zavicefta, Zithromax, Octagam, and Panzyga brands; and biologics, small molecules, immunotherapies, and biosimilars under the Ibrance, Xtandi, Padcev, Adcetris, Inlyta, Lorbrena, Bosulif, Tukysa, Braftovi, Mektovi, Orgovyx, Elrexfio, Tivdak, and Talzenna brands. In addition, the company involved in the contract manufacturing business. It serves wholesalers, retailers, hospitals, clinics, government agencies, pharmacies, individual provider offices, retail pharmacies, and integrated delivery systems. The company has collaboration agreements with Bristol-Myers Squibb Company; Astellas Pharma US, Inc.; Merck KGaA; and BioNTech SE. Pfizer Inc. was founded in 1849 and is headquartered in New York, New York.",81000,"[{'maxAge': 1, 'name': 'Dr. Albert  Bourla D.V.M., Ph.D.', 'age': 62, 'title': 'Chairman of the Board & CEO', 'yearBorn': 1962, 'fiscalYear': 2024, 'totalPay': 9816064, 'exercisedValue': 679998, 'unexercisedValue': 0}, {'maxAge': 1, 'name': 'Mr. David M. Denton', 'age': 59, 'title': 'CFO & Executive VP', 'yearBorn': 1965, 'fiscalYear': 2024, 'totalPay': 4547273, 'exercisedValue': 0, 'unexercisedValue': 0}, {'maxAge': 1, 'name': 'Dr. Chris  Boshoff FMedSci, M.D., Ph.D.', 'age': 60, 'title': 'Chief Scientific Officer and President of Research & Development', 'yearBorn': 1964, 'fiscalYear': 2024, 'totalPay': 4707830, 'exercisedValue': 51941, 'unexercisedValue': 0}, {'maxAge': 1, 'name': 'Ms. Jennifer B. Damico', 'age': 56, 'title': 'Senior VP, Controller & Principal Accounting Officer', 'yearBorn': 1968, 'fiscalYear': 2024, 'exercisedValue': 0, 'unexercisedValue': 0}, {'maxAge': 1, 'name': 'Ms. Lidia L. Fonseca', 'age': 55, 'title': 'Executive VP and Chief Digital & Technology Officer', 'yearBorn': 1969, 'fiscalYear': 2024, 'exercisedValue': 0, 'unexercisedValue': 0}, {'maxAge': 1, 'name': 'Ms. Francesca M. DeMartino', 'title': 'Chief Investor Relations Officer', 'fiscalYear': 2024, 'exercisedValue': 0, 'unexercisedValue': 0}, {'maxAge': 1, 'name': 'Mr. Douglas M. Lankler', 'age': 58, 'title': 'Executive VP & Chief Legal Officer', 'yearBorn': 1966, 'fiscalYear': 2024, 'totalPay': 1760205, 'exercisedValue': 0, 'unexercisedValue': 138845}, {'maxAge': 1, 'name': 'Ms. Payal Sahni Becher', 'age': 49, 'title': 'Chief People Experience Officer & Executive VP', 'yearBorn': 1975, 'fiscalYear': 2024, 'exercisedValue': 0, 'unexercisedValue': 0}, {'maxAge': 1, 'name': 'Ms. Sally M. Susman', 'age': 62, 'title': 'Executive VP & Chief Corporate Affairs Officer', 'yearBorn': 1962, 'fiscalYear': 2024, 'exercisedValue': 0, 'unexercisedValue': 0}, {'maxAge': 1, 'name': 'Dr. Michael S. Vincent M.D., Ph.D.', 'title': 'Senior VP and Chief Scientific Officer of Inflammation & Immunology', 'fiscalYear': 2024, 'exercisedValue': 0, 'unexercisedValue': 0}]",10,6,10,1,9,1756684800,1735603200,http://www.pfizer.com/investors/,[],86400,2,23.97,23.96,23.87,24.22,23.97,23.96,23.87,24.22,1.72,7.18,1753401600,0.89949995,4.69,0.461,12.645502,8.156997,56954854,56954854,41600866,43586290,43586290,23.92,23.96,40,78,1.36E+11,20.92,30.43,2.1287522,24.7766,24.89835,1.7,0.07092199,USD,FALSE,1.85E+11,0.16844,5675885064,5685550080,103465144,107778211,1753920000,1756425600,0.0182,0.00073,0.67093,2.37,0.0182,5743470080,15.602,1.5318549,1735603200,1767139200,1751155200,69.976,10727999488,1.89,2.93,1054:1000,1605571200,2.898,7.549,-0.19644654,0.17405021,0.43,1753401600,EQUITY,23.9,36,24,28.85714,28,2.43478,buy,21,13249000448,2.33,24505999360,62044000256,0.778,1.158,63833001984,69.703,11.252,0.0525,0.12168,47120998400,16017999872,15187999744,69.74,0.103,0.73819,0.38391,0.28684,USD,PFE,en-US,US,Equity,Nasdaq Real Time Price,TRUE,HIGH,POST,0.16736785,23.94,0.040000916,-0.0699997,23.87 - 24.22,NYSE,41600866,2.9799995,0.1424474,20.92 - 30.43,-6.5300007,-0.21459088,-19.644653,1756771200,1754397000,[],1758065528,1758052802,NYQ,finmb_162270,America/New_York,EDT,-14400000,us_market,FALSE,-0.29203,23.9,"Pfizer, Inc.",Pfizer Inc.,1762259400,1762259400,1754402400,1754402400,TRUE,1.89,2.93,3.09366,7.7254767,-0.87660027,-0.03538017,-0.99835014,-0.04009704,15,0,,TRUE,76253400000,,2.4 - Buy,FALSE,Pfizer,0.96,,,,
LOW,77,1000 Lowes Blvd.,Mooresville,NC,28117,United States,704 758 1000,https://www.lowes.com,Home Improvement Retail,home-improvement-retail,Home Improvement Retail,Consumer Cyclical,consumer-cyclical,Consumer Cyclical,"Lowe's Companies, Inc., together with its subsidiaries, operates as a home improvement retailer in the United States. It provides a line of products for construction, maintenance, repair, remodeling, and decorating. The company also offers home improvement products, such as appliances, seasonal and outdoor living, lumber, lawn and garden, kitchens and bath, hardware, building materials, millwork, paint, rough plumbing, tools, electrical, flooring, and dcor. In addition, it offers installation services through independent contractors in various product categories; and extended protection plans and repair services. The company sells its national brand-name merchandise and private brand products to professional customers, individual homeowners, and renters. The company also sells its products through Lowes.com website, as well as through mobile applications. Further, it provides design, distribution, and installation services for interior surface finishes to home builders and property managers. Lowe's Companies, Inc. was founded in 1921 and is based in Mooresville, North Carolina.",300000,"[{'maxAge': 1, 'name': 'Mr. Marvin R. Ellison', 'age': 59, 'title': 'President, CEO & Chairman', 'yearBorn': 1965, 'fiscalYear': 2024, 'totalPay': 4439570, 'exercisedValue': 0, 'unexercisedValue': 68135848}, {'maxAge': 1, 'name': 'Mr. Brandon J. Sink CPA', 'age': 48, 'title': 'Executive VP & CFO', 'yearBorn': 1976, 'fiscalYear': 2024, 'totalPay': 1590620, 'exercisedValue': 671202, 'unexercisedValue': 1900747}, {'maxAge': 1, 'name': 'Ms. Seemantini  Godbole', 'age': 54, 'title': 'Executive VP and Chief Information & Digital Officer', 'yearBorn': 1970, 'fiscalYear': 2024, 'totalPay': 1693105, 'exercisedValue': 8754471, 'unexercisedValue': 1661529}, {'maxAge': 1, 'name': 'Mr. William P. Boltz', 'age': 61, 'title': 'Executive Vice President of Merchandising', 'yearBorn': 1963, 'fiscalYear': 2024, 'totalPay': 1807774, 'exercisedValue': 0, 'unexercisedValue': 1975462}, {'maxAge': 1, 'name': 'Mr. Joseph Michael McFarland III', 'age': 54, 'title': 'Executive Vice President of Stores', 'yearBorn': 1970, 'fiscalYear': 2024, 'totalPay': 1750045, 'exercisedValue': 0, 'unexercisedValue': 20549756}, {'maxAge': 1, 'name': 'Mr. Dan Clayton Griggs Jr.', 'age': 46, 'title': 'Senior VP of Tax & Chief Accounting Officer', 'yearBorn': 1978, 'fiscalYear': 2024, 'exercisedValue': 0, 'unexercisedValue': 0}, {'maxAge': 1, 'name': 'Ms. Kate  Pearlman', 'title': 'Vice President, Investor Relations & Treasurer', 'fiscalYear': 2024, 'exercisedValue': 0, 'unexercisedValue': 0}, {'maxAge': 1, 'name': 'Ms. Juliette Williams Pryor J.D.', 'age': 59, 'title': 'Executive VP, Chief Legal Officer & Corporate Secretary', 'yearBorn': 1965, 'fiscalYear': 2024, 'totalPay': 4257676, 'exercisedValue': 0, 'unexercisedValue': 0}, {'maxAge': 1, 'name': 'Mr. Luis A. Avila Esq.', 'title': 'Senior VP of Corporate Governance & Chief Compliance Officer', 'fiscalYear': 2024, 'exercisedValue': 0, 'unexercisedValue': 0}, {'maxAge': 1, 'name': 'Ms. Jennifer E. Wilson', 'title': 'Senior VP & Chief Marketing Officer', 'fiscalYear': 2024, 'exercisedValue': 0, 'unexercisedValue': 0}]",4,5,5,3,4,1756684800,1735603200,http://phx.corporate-ir.net/phoenix.zhtml?c=95223&p=irol-IRHome,[],86400,2,272.09,272.93,269.41,273.275,272.09,272.93,269.41,273.275,4.8,1.76,1761091200,0.3815,1.7,0.873,22.191961,21.418842,1940675,1940675,2857572,2784440,2784440,270.64,270.67,1,1,1.52E+11,206.39,287.01,1.8145049,243.4742,240.00885,4.65,0.017089933,USD,FALSE,1.86E+11,0.08202,559652781,560825024,7880394,8082469,1753920000,1756425600,0.014099999,0.00119,0.79179,2.58,0.014099999,560825024,-20.321,-13.312337,1738281600,1769817600,1754006400,0.006,6840000000,12.19,12.63,2:01,1151884800,2.219,14.855,0.05987072,0.17405021,1.2,1753228800,EQUITY,270.52,325,221,281.8387,283,1.91429,buy,31,5256000000,9.372,12490999808,39089999872,0.243,1.047,83612000256,,148.908,0.14288001,,27979999232,6854249984,9820000256,0.024,0.016,0.33464,0.14939,0.14479,USD,LOW,en-US,US,Equity,Delayed Quote,TRUE,HIGH,POST,0.64690226,272.27,1.75,-1.57001,269.41 - 273.275,NYSE,2857572,64.12999,0.31072238,206.39 - 287.01,-16.49002,-0.057454515,5.987072,1762300800,1763555400,[],1758064099,1758052802,NYQ,finmb_180871,America/New_York,EDT,-14400000,us_market,FALSE,-0.577018,270.52,"Lowe's Companies, Inc.","Lowe's Companies, Inc.",1763555400,1763555400,1747832400,1747832400,FALSE,12.19,12.63,12.31472,21.967205,27.045792,0.111082785,30.511139,0.12712505,15,0,,TRUE,3.22E+11,,1.9 - Buy,FALSE,Lowe's Companies,2.6131,,,,
