Ticker,rank,address1,city,state,zip,country,phone,website,industry,industryKey,industryDisp,sector,sectorKey,sectorDisp,longBusinessSummary,fullTimeEmployees,companyOfficers,auditRisk,boardRisk,compensationRisk,shareHolderRightsRisk,overallRisk,governanceEpochDate,compensationAsOfEpochDate,irWebsite,executiveTeam,maxAge,priceHint,previousClose,open,dayLow,dayHigh,regularMarketPreviousClose,regularMarketOpen,regularMarketDayLow,regularMarketDayHigh,dividendRate,dividendYield,exDividendDate,payoutRatio,fiveYearAvgDividendYield,beta,trailingPE,forwardPE,volume,regularMarketVolume,averageVolume,averageVolume10days,averageDailyVolume10Day,bid,ask,bidSize,askSize,marketCap,fiftyTwoWeekLow,fiftyTwoWeekHigh,priceToSalesTrailing12Months,fiftyDayAverage,twoHundredDayAverage,trailingAnnualDividendRate,trailingAnnualDividendYield,currency,tradeable,enterpriseValue,profitMargins,floatShares,sharesOutstanding,sharesShort,sharesShortPriorMonth,sharesShortPreviousMonthDate,dateShortInterest,sharesPercentSharesOut,heldPercentInsiders,heldPercentInstitutions,shortRatio,shortPercentOfFloat,impliedSharesOutstanding,bookValue,priceToBook,lastFiscalYearEnd,nextFiscalYearEnd,mostRecentQuarter,earningsQuarterlyGrowth,netIncomeToCommon,trailingEps,forwardEps,lastSplitFactor,lastSplitDate,enterpriseToRevenue,enterpriseToEbitda,52WeekChange,SandP52WeekChange,lastDividendValue,lastDividendDate,quoteType,currentPrice,targetHighPrice,targetLowPrice,targetMeanPrice,targetMedianPrice,recommendationMean,recommendationKey,numberOfAnalystOpinions,totalCash,totalCashPerShare,ebitda,totalDebt,quickRatio,currentRatio,totalRevenue,debtToEquity,revenuePerShare,returnOnAssets,returnOnEquity,grossProfits,freeCashflow,operatingCashflow,earningsGrowth,revenueGrowth,grossMargins,ebitdaMargins,operatingMargins,financialCurrency,symbol,language,region,typeDisp,quoteSourceName,triggerable,customPriceAlertConfidence,marketState,postMarketChangePercent,postMarketPrice,postMarketChange,regularMarketChange,regularMarketDayRange,fullExchangeName,averageDailyVolume3Month,fiftyTwoWeekLowChange,fiftyTwoWeekLowChangePercent,fiftyTwoWeekRange,fiftyTwoWeekHighChange,fiftyTwoWeekHighChangePercent,fiftyTwoWeekChangePercent,dividendDate,earningsTimestamp,corporateActions,postMarketTime,regularMarketTime,exchange,messageBoardId,exchangeTimezoneName,exchangeTimezoneShortName,gmtOffSetMilliseconds,market,esgPopulated,regularMarketChangePercent,regularMarketPrice,shortName,longName,earningsTimestampStart,earningsTimestampEnd,earningsCallTimestampStart,earningsCallTimestampEnd,isEarningsDateEstimate,epsTrailingTwelveMonths,epsForward,epsCurrentYear,priceEpsCurrentYear,fiftyDayAverageChange,fiftyDayAverageChangePercent,twoHundredDayAverageChange,twoHundredDayAverageChangePercent,sourceInterval,exchangeDataDelayedBy,prevName,hasPrePostMarketData,firstTradeDateMilliseconds,nameChangeDate,averageAnalystRating,cryptoTradeable,displayName,trailingPegRatio,ipoExpectedDate,address2,fax,industrySymbol
NVDA,1,2788 San Tomas Expressway,Santa Clara,CA,95051,United States,408 486 2000,https://www.nvidia.com,Semiconductors,semiconductors,Semiconductors,Technology,technology,Technology,"NVIDIA Corporation, a computing infrastructure company, provides graphics and compute and networking solutions in the United States, Singapore, Taiwan, China, Hong Kong, and internationally. The Compute & Networking segment includes its Data Centre accelerated computing platforms and artificial intelligence solutions and software; networking; automotive platforms and autonomous and electric vehicle solutions; Jetson for robotics and other embedded platforms; and DGX Cloud computing services. The Graphics segment offers GeForce GPUs for gaming and PCs, the GeForce NOW game streaming service and related infrastructure, and solutions for gaming platforms; Quadro/NVIDIA RTX GPUs for enterprise workstation graphics; virtual GPU or vGPU software for cloud-based visual and virtual computing; automotive platforms for infotainment systems; and Omniverse software for building and operating industrial AI and digital twin applications. It also customized agentic solutions designed in collaboration with NVIDIA to accelerate enterprise AI adoption. The company's products are used in gaming, professional visualization, data center, and automotive markets. It sells its products to original equipment manufacturers, original device manufacturers, system integrators and distributors, independent software vendors, cloud service providers, consumer internet companies, add-in board manufacturers, distributors, automotive manufacturers and tier-1 automotive suppliers, and other ecosystem participants. NVIDIA Corporation was incorporated in 1993 and is headquartered in Santa Clara, California.",36000,"[{'maxAge': 1, 'name': 'Mr. Jen-Hsun  Huang', 'age': 61, 'title': 'Co-Founder, CEO, President & Director', 'yearBorn': 1963, 'fiscalYear': 2025, 'totalPay': 11054945, 'exercisedValue': 0, 'unexercisedValue': 0}, {'maxAge': 1, 'name': 'Ms. Colette M. Kress', 'age': 57, 'title': 'Executive VP & CFO', 'yearBorn': 1967, 'fiscalYear': 2025, 'totalPay': 1512641, 'exercisedValue': 0, 'unexercisedValue': 0}, {'maxAge': 1, 'name': 'Ms. Debora  Shoquist', 'age': 69, 'title': 'Executive Vice President of Operations', 'yearBorn': 1955, 'fiscalYear': 2025, 'totalPay': 1379071, 'exercisedValue': 0, 'unexercisedValue': 0}, {'maxAge': 1, 'name': 'Mr. Timothy S. Teter J.D.', 'age': 57, 'title': 'Executive VP, General Counsel & Secretary', 'yearBorn': 1967, 'fiscalYear': 2025, 'totalPay': 1362989, 'exercisedValue': 0, 'unexercisedValue': 0}, {'maxAge': 1, 'name': 'Mr. Ajay K. Puri', 'age': 69, 'title': 'Executive Vice President of Worldwide Field Operations', 'yearBorn': 1955, 'fiscalYear': 2025, 'totalPay': 2313851, 'exercisedValue': 0, 'unexercisedValue': 0}, {'maxAge': 1, 'name': 'Mr. Chris A. Malachowsky', 'title': 'Co-Founder', 'fiscalYear': 2025, 'totalPay': 320000, 'exercisedValue': 0, 'unexercisedValue': 0}, {'maxAge': 1, 'name': 'Mr. Donald F. Robertson Jr.', 'age': 55, 'title': 'VP & Chief Accounting Officer', 'yearBorn': 1969, 'fiscalYear': 2025, 'exercisedValue': 0, 'unexercisedValue': 0}, {'maxAge': 1, 'name': 'Prof. William J. Dally Ph.D.', 'age': 63, 'title': 'Chief Scientist & Senior VP of Research', 'yearBorn': 1961, 'fiscalYear': 2025, 'exercisedValue': 0, 'unexercisedValue': 0}, {'maxAge': 1, 'name': 'Mr. Toshiya  Hari', 'title': 'Vice President of Investor Relations & Strategic Finance', 'fiscalYear': 2025, 'exercisedValue': 0, 'unexercisedValue': 0}, {'maxAge': 1, 'name': 'Ms. Mylene  Mangalindan', 'title': 'VP of Corporate Communications', 'fiscalYear': 2025, 'exercisedValue': 0, 'unexercisedValue': 0}]",4,10,4,8,8,1756684800,1767139200,http://phx.corporate-ir.net/phoenix.zhtml?c=116466&p=irol-IRHome,[],86400,2,177.749,176.995,174.38,177.5,177.749,176.995,174.38,177.5,0.04,0.02,1757548800,0.0114,0.06,2.102,50.689857,42.446606,136363238,136363238,173370833,173275580,173275580,174.75,174.97,5,5,4.33E+12,86.62,184.48,26.19379,174.4888,140.14725,0.04,0.000225036,USD,FALSE,4.27E+12,0.52414,23323140000,24347000832,196695074,192121364,1753920000,1756425600,0.0081,0.043319996,0.68971,1.14,0.0084,24746600448,4.113,42.518845,1737849600,1769385600,1753574400,0.592,86597001216,3.45,4.12,10:01,1717977600,25.864,43.479,0.53776276,0.17405021,0.01,1757548800,EQUITY,174.88,270,100,209.19376,210,1.375,strong_buy,56,56790999040,2.337,98280996864,10597999616,3.488,4.214,1.65E+11,10.584,6.755,0.53094,1.09417,1.15E+11,52436750336,77035003904,0.612,0.556,0.69847,0.59486,0.60842997,USD,NVDA,en-US,US,Equity,Nasdaq Real Time Price,TRUE,HIGH,POST,0.24016362,175.3,0.41999817,-2.868988,174.38 - 177.5,NasdaqGS,173370833,88.26,1.0189333,86.62 - 184.48,-9.599991,-0.052038115,53.776276,1759363200,1763582400,[],1758065497,1758052800,NMS,finmb_32307,America/New_York,EDT,-14400000,us_market,FALSE,-1.6140672,174.88,NVIDIA Corporation,NVIDIA Corporation,1763582400,1763582400,1756328400,1756328400,FALSE,3.45,4.12,4.49223,38.929443,0.39120483,0.002242005,34.732758,0.24783047,15,0,Usual Stablecoin,TRUE,9.17E+11,9/12/2025,1.4 - Strong Buy,FALSE,NVIDIA,1.3253,,,,
MSFT,2,One Microsoft Way,Redmond,WA,98052-6399,United States,425 882 8080,https://www.microsoft.com,Software - Infrastructure,software-infrastructure,Software - Infrastructure,Technology,technology,Technology,"Microsoft Corporation develops and supports software, services, devices, and solutions worldwide. The company's Productivity and Business Processes segment offers Microsoft 365 Commercial, Enterprise Mobility + Security, Windows Commercial, Power BI, Exchange, SharePoint, Microsoft Teams, Security and Compliance, and Copilot; Microsoft 365 Commercial products, such as Windows Commercial on-premises and Office licensed services; Microsoft 365 Consumer products and cloud services, such as Microsoft 365 Consumer subscriptions, Office licensed on-premises, and other consumer services; LinkedIn; Dynamics products and cloud services, such as Dynamics 365, cloud-based applications, and on-premises ERP and CRM applications. Its Intelligent Cloud segment provides Server products and cloud services, such as Azure and other cloud services, GitHub, Nuance Healthcare, virtual desktop offerings, and other cloud services; Server products, including SQL and Windows Server, Visual Studio and System Center related Client Access Licenses, and other on-premises offerings; Enterprise and partner services, including Enterprise Support and Nuance professional Services, Industry Solutions, Microsoft Partner Network, and Learning Experience. The company's Personal Computing segment provides Windows and Devices, such as Windows OEM licensing and Devices and Surface and PC accessories; Gaming services and solutions, such as Xbox hardware, content, and services, first- and third-party content Xbox Game Pass, subscriptions, and Cloud Gaming, advertising, and other cloud services; search and news advertising services, such as Bing and Copilot, Microsoft News and Edge, and third-party affiliates. It sells its products through OEMs, distributors, and resellers; and online and retail stores. The company was founded in 1975 and is headquartered in Redmond, Washington.",228000,"[{'maxAge': 1, 'name': 'Mr. Satya  Nadella', 'age': 57, 'title': 'Chairman & CEO', 'yearBorn': 1967, 'fiscalYear': 2024, 'totalPay': 7869791, 'exercisedValue': 0, 'unexercisedValue': 0}, {'maxAge': 1, 'name': 'Mr. Bradford L. Smith LCA', 'age': 65, 'title': 'President & Vice Chairman', 'yearBorn': 1959, 'fiscalYear': 2024, 'totalPay': 4755618, 'exercisedValue': 0, 'unexercisedValue': 0}, {'maxAge': 1, 'name': 'Ms. Amy E. Hood', 'age': 52, 'title': 'Executive VP & CFO', 'yearBorn': 1972, 'fiscalYear': 2024, 'totalPay': 4704250, 'exercisedValue': 0, 'unexercisedValue': 0}, {'maxAge': 1, 'name': 'Mr. Judson B. Althoff', 'age': 51, 'title': 'Executive VP & Chief Commercial Officer', 'yearBorn': 1973, 'fiscalYear': 2024, 'totalPay': 4534974, 'exercisedValue': 0, 'unexercisedValue': 0}, {'maxAge': 1, 'name': 'Ms. Carolina  Dybeck Happe', 'age': 52, 'title': 'Executive VP & COO', 'yearBorn': 1972, 'fiscalYear': 2024, 'exercisedValue': 0, 'unexercisedValue': 0}, {'maxAge': 1, 'name': 'Ms. Alice L. Jolla', 'age': 58, 'title': 'Corporate VP & Chief Accounting Officer', 'yearBorn': 1966, 'fiscalYear': 2024, 'exercisedValue': 0, 'unexercisedValue': 0}, {'maxAge': 1, 'name': 'Jonathan  Neilson', 'title': 'Vice President of Investor Relations', 'fiscalYear': 2024, 'exercisedValue': 0, 'unexercisedValue': 0}, {'maxAge': 1, 'name': 'Mr. Hossein  Nowbar', 'title': 'Chief Legal Officer', 'fiscalYear': 2024, 'exercisedValue': 0, 'unexercisedValue': 0}, {'maxAge': 1, 'name': 'Mr. Frank X. Shaw', 'title': 'Chief Communications Officer', 'fiscalYear': 2024, 'exercisedValue': 0, 'unexercisedValue': 0}, {'maxAge': 1, 'name': 'Mr. Takeshi  Numoto', 'age': 53, 'title': 'Executive VP & Chief Marketing Officer', 'yearBorn': 1971, 'fiscalYear': 2024, 'exercisedValue': 0, 'unexercisedValue': 0}]",9,5,4,2,3,1756684800,1735603200,http://www.microsoft.com/investor/default.aspx,[],86400,2,515.36,516.88,508.6,517.23,515.36,516.88,508.6,517.23,3.32,0.64,1755734400,0.2375,0.82,1.04,37.265007,34.0495,19508071,19508071,20416753,19439970,19439970,490.96,509.34,1,2,3.78E+12,344.79,555.45,13.430808,510.7228,446.63046,3.32,0.006442099,USD,FALSE,3.80E+12,0.36146,7422239624,7433169920,58491994,52644614,1753920000,1756425600,0.007900001,0.00067,0.74494004,2.56,0.007900001,7433169920,46.204,11.017228,1751241600,1782777600,1751241600,0.236,1.02E+11,13.66,14.95,2:01,1045526400,13.493,24.286,0.18432724,0.17405021,0.83,1755734400,EQUITY,509.04,700,483,615.3839,630,1.26316,strong_buy,51,94564999168,12.722,1.57E+11,1.12E+11,1.223,1.353,2.82E+11,32.661,37.902,0.14203,0.33280998,1.94E+11,61070376960,1.36E+11,0.237,0.181,0.68824,0.55561,0.44901,USD,MSFT,en-US,US,Equity,Nasdaq Real Time Price,TRUE,HIGH,POST,0.20823462,510.1,1.0599976,-6.319977,508.6 - 517.23,NasdaqGS,20416753,164.25,0.47637692,344.79 - 555.45,-46.410004,-0.08355388,18.432724,1757548800,1753905600,[],1758065481,1758052801,NMS,finmb_21835,America/New_York,EDT,-14400000,us_market,FALSE,-1.2263228,509.04,Microsoft Corporation,Microsoft Corporation,1761768000,1761768000,1753911000,1753911000,TRUE,13.66,14.95,15.51986,32.799267,-1.6828003,-0.003294939,62.409546,0.1397342,15,0,,TRUE,5.11E+11,,1.3 - Strong Buy,FALSE,Microsoft,2.2577,,,,
AAPL,3,One Apple Park Way,Cupertino,CA,95014,United States,(408) 996-1010,https://www.apple.com,Consumer Electronics,consumer-electronics,Consumer Electronics,Technology,technology,Technology,"Apple Inc. designs, manufactures, and markets smartphones, personal computers, tablets, wearables, and accessories worldwide. The company offers iPhone, a line of smartphones; Mac, a line of personal computers; iPad, a line of multi-purpose tablets; and wearables, home, and accessories comprising AirPods, Apple TV, Apple Watch, Beats products, and HomePod. It also provides AppleCare support and cloud services; and operates various platforms, including the App Store that allow customers to discover and download applications and digital content, such as books, music, video, games, and podcasts, as well as advertising services include third-party licensing arrangements and its own advertising platforms. In addition, the company offers various subscription-based services, such as Apple Arcade, a game subscription service; Apple Fitness+, a personalized fitness service; Apple Music, which offers users a curated listening experience with on-demand radio stations; Apple News+, a subscription news and magazine service; Apple TV+, which offers exclusive original content; Apple Card, a co-branded credit card; and Apple Pay, a cashless payment service, as well as licenses its intellectual property. The company serves consumers, and small and mid-sized businesses; and the education, enterprise, and government markets. It distributes third-party applications for its products through the App Store. The company also sells its products through its retail and online stores, and direct sales force; and third-party cellular network carriers, wholesalers, retailers, and resellers. Apple Inc. was founded in 1976 and is headquartered in Cupertino, California.",150000,"[{'maxAge': 1, 'name': 'Mr. Timothy D. Cook', 'age': 63, 'title': 'CEO & Director', 'yearBorn': 1961, 'fiscalYear': 2024, 'totalPay': 16520856, 'exercisedValue': 0, 'unexercisedValue': 0}, {'maxAge': 1, 'name': 'Ms. Katherine L. Adams', 'age': 60, 'title': 'Senior VP, General Counsel & Secretary', 'yearBorn': 1964, 'fiscalYear': 2024, 'totalPay': 5022182, 'exercisedValue': 0, 'unexercisedValue': 0}, {'maxAge': 1, 'name': ""Ms. Deirdre  O'Brien"", 'age': 57, 'title': 'Chief People Officer & Senior VP of Retail', 'yearBorn': 1967, 'fiscalYear': 2024, 'totalPay': 5022182, 'exercisedValue': 0, 'unexercisedValue': 0}, {'maxAge': 1, 'name': 'Mr. Jeffrey E. Williams', 'age': 60, 'title': 'Senior Vice President of Design, Watch, & Health', 'yearBorn': 1964, 'fiscalYear': 2024, 'totalPay': 5020737, 'exercisedValue': 0, 'unexercisedValue': 0}, {'maxAge': 1, 'name': 'Mr. Kevan  Parekh', 'age': 52, 'title': 'Senior VP & CFO', 'yearBorn': 1972, 'fiscalYear': 2024, 'exercisedValue': 0, 'unexercisedValue': 0}, {'maxAge': 1, 'name': 'Mr. Sabih  Khan', 'title': 'Chief Operating Officer', 'fiscalYear': 2024, 'exercisedValue': 0, 'unexercisedValue': 0}, {'maxAge': 1, 'name': 'Mr. Chris  Kondo', 'title': 'Senior Director of Corporate Accounting', 'fiscalYear': 2024, 'exercisedValue': 0, 'unexercisedValue': 0}, {'maxAge': 1, 'name': 'Suhasini  Chandramouli', 'title': 'Director of Investor Relations', 'fiscalYear': 2024, 'exercisedValue': 0, 'unexercisedValue': 0}, {'maxAge': 1, 'name': 'Ms. Kristin Huguet Quayle', 'title': 'Vice President of Worldwide Communications', 'fiscalYear': 2024, 'exercisedValue': 0, 'unexercisedValue': 0}, {'maxAge': 1, 'name': 'Mr. Greg  Joswiak', 'title': 'Senior Vice President of Worldwide Marketing', 'fiscalYear': 2024, 'exercisedValue': 0, 'unexercisedValue': 0}]",7,1,3,1,1,1756684800,1735603200,http://investor.apple.com/,[],86400,2,236.7,237.18,236.3235,241.22,236.7,237.18,236.3235,241.22,1.04,0.44,1754870400,0.1533,0.54,1.109,36.19301,28.658241,61213800,61213800,54915327,56036670,56036670,236,249.1,1,1,3.53E+12,169.21,260.1,8.649107,221.5888,221.55185,1.01,0.004267005,USD,FALSE,3.58E+12,0.24295999,14814419318,14840399872,113582365,104634941,1753920000,1756425600,0.0077,0.0197,0.63639,1.95,0.0077,15318899712,4.431,53.74633,1727481600,1759017600,1751068800,0.093,99280003072,6.58,8.31,4:01,1598832000,8.763,25.27,0.09184003,0.17405021,0.26,1754870400,EQUITY,238.15,300,175,240.69057,243,2.02128,buy,40,55372001280,3.731,1.42E+11,1.02E+11,0.724,0.868,4.09E+11,154.486,27.173,0.24545999,1.49814,1.91E+11,94873747456,1.09E+11,0.121,0.096,0.46678,0.34675997,0.29990998,USD,AAPL,en-US,US,Equity,Nasdaq Real Time Price,TRUE,HIGH,POST,-0.113369316,237.88,-0.269989,1.449997,236.3235 - 241.22,NasdaqGS,54915327,68.93999,0.40742263,169.21 - 260.1,-21.950012,-0.08439066,9.184003,1755129600,1753992000,[],1758065467,1758052801,NMS,finmb_24937,America/New_York,EDT,-14400000,us_market,FALSE,0.6125885,238.15,Apple Inc.,Apple Inc.,1761854400,1761854400,1753995600,1753995600,TRUE,6.58,8.31,7.38338,32.254875,16.561188,0.074738376,16.598145,0.07491765,15,0,,TRUE,3.45E+11,,2.0 - Buy,FALSE,Apple,2.2932,,,,
GOOGL,4,1600 Amphitheatre Parkway,Mountain View,CA,94043,United States,650-253-0000,https://abc.xyz,Internet Content & Information,internet-content-information,Internet Content & Information,Communication Services,communication-services,Communication Services,"Alphabet Inc. offers various products and platforms in the United States, Europe, the Middle East, Africa, the Asia-Pacific, Canada, and Latin America. It operates through Google Services, Google Cloud, and Other Bets segments. The Google Services segment provides products and services, including ads, Android, Chrome, devices, Gmail, Google Drive, Google Maps, Google Photos, Google Play, Search, and YouTube. It is also involved in the sale of apps and in-app purchases and digital content in the Google Play and YouTube; and devices, as well as in the provision of YouTube consumer subscription services. The Google Cloud segment offers AI infrastructure, Vertex AI platform, cybersecurity, data and analytics, and other services; Google Workspace that include cloud-based communication and collaboration tools for enterprises, such as Calendar, Gmail, Docs, Drive, and Meet; and other services for enterprise customers. The Other Bets segment sells healthcare-related and internet services. The company was incorporated in 1998 and is headquartered in Mountain View, California.",187103,"[{'maxAge': 1, 'name': 'Mr. Sundar  Pichai', 'age': 51, 'title': 'CEO & Director', 'yearBorn': 1973, 'fiscalYear': 2024, 'totalPay': 10319413, 'exercisedValue': 0, 'unexercisedValue': 0}, {'maxAge': 1, 'name': 'Ms. Ruth M. Porat', 'age': 66, 'title': 'President & Chief Investment Officer', 'yearBorn': 1958, 'fiscalYear': 2024, 'totalPay': 3023363, 'exercisedValue': 0, 'unexercisedValue': 0}, {'maxAge': 1, 'name': 'Dr. Lawrence Edward Page II', 'age': 51, 'title': 'Co-Founder & Director', 'yearBorn': 1973, 'fiscalYear': 2024, 'totalPay': 1, 'exercisedValue': 0, 'unexercisedValue': 0}, {'maxAge': 1, 'name': 'Mr. Sergey  Brin', 'age': 50, 'title': 'Co-Founder & Director', 'yearBorn': 1974, 'fiscalYear': 2024, 'totalPay': 1, 'exercisedValue': 0, 'unexercisedValue': 0}, {'maxAge': 1, 'name': 'Ms. Anat  Ashkenazi', 'age': 51, 'title': 'Senior VP & CFO', 'yearBorn': 1973, 'fiscalYear': 2024, 'totalPay': 11455556, 'exercisedValue': 0, 'unexercisedValue': 0}, {'maxAge': 1, 'name': 'Mr. J. Kent Walker', 'age': 63, 'title': 'President of Global Affairs, Chief Legal Officer & Company Secretary', 'yearBorn': 1961, 'fiscalYear': 2024, 'totalPay': 3019696, 'exercisedValue': 0, 'unexercisedValue': 0}, {'maxAge': 1, 'name': 'Mr. Philipp  Schindler', 'age': 53, 'title': 'Senior Vice President & Chief Business Officer of Google', 'yearBorn': 1971, 'fiscalYear': 2024, 'totalPay': 3051699, 'exercisedValue': 0, 'unexercisedValue': 0}, {'maxAge': 1, 'name': ""Ms. Amie Thuener O'Toole"", 'age': 49, 'title': 'Corporate Controller, Chief Accounting Officer & VP', 'yearBorn': 1975, 'fiscalYear': 2024, 'exercisedValue': 0, 'unexercisedValue': 0}, {'maxAge': 1, 'name': 'Ms. Ellen  West', 'title': 'Vice President of Investor Relations', 'fiscalYear': 2024, 'exercisedValue': 0, 'unexercisedValue': 0}, {'maxAge': 1, 'name': 'Ms. Fiona Clare Cicconi', 'age': 58, 'title': 'Chief People Officer', 'yearBorn': 1966, 'fiscalYear': 2024, 'exercisedValue': 0, 'unexercisedValue': 0}]",7,9,10,10,10,1756684800,1735603200,,[],86400,2,251.61,252.125,249.47,253.04,251.61,252.125,249.47,253.04,0.84,0.33,1757289600,0.0864,,1.011,26.747602,28.03125,34072967,34072967,38943201,47046270,47046270,250.92,251.34,1,1,3.04E+12,140.53,253.04,8.1807785,202.6672,181.47446,1.01,0.004014149,USD,FALSE,2.98E+12,0.31118,10836465880,5816999936,55471936,57377636,1753920000,1756425600,0.0046,0.00258,0.80908996,1.79,0.0095,12097200128,29.983,8.376747,1735603200,1767139200,1751241600,0.194,1.16E+11,9.39,8.96,20:01,1658102400,8.035,21.187,0.5792744,0.17405021,0.21,1757289600,EQUITY,251.16,300,185,233.66,230,1.55385,buy,50,95147999232,7.867,1.41E+11,41668001792,1.72,1.904,3.71E+11,11.481,30.428,0.16792,0.34829,2.19E+11,49786499072,1.34E+11,0.223,0.138,0.58943003,0.37922,0.32429,USD,GOOGL,en-US,US,Equity,Nasdaq Real Time Price,TRUE,HIGH,POST,0.06330489,251.319,0.15899658,-0.44999695,249.47 - 253.04,NasdaqGS,38943201,110.630005,0.78723407,140.53 - 253.04,-1.8799896,-0.007429615,57.92744,1757894400,1753300800,[],1758065494,1758052801,NMS,finmb_29096,America/New_York,EDT,-14400000,us_market,FALSE,-0.17884701,251.16,Alphabet Inc.,Alphabet Inc.,1753300800,1753300800,1753302600,1753302600,FALSE,9.39,8.96,9.94998,25.242262,48.492798,0.23927304,69.68555,0.38399646,15,0,,TRUE,1.09E+12,,1.6 - Buy,FALSE,,1.7117,,,,
