PG,24,One Procter & Gamble Plaza,Cincinnati,OH,45202,United States,513 983 1100,https://www.pginvestor.com,Household & Personal Products,household-personal-products,Household & Personal Products,Consumer Defensive,consumer-defensive,Consumer Defensive,"The Procter & Gamble Company provides branded consumer packaged goods worldwide. It operates through Beauty; Grooming; Health Care; Fabric & Home Care; and Baby, Feminine & Family Care segments. The company offers conditioners, shampoos, styling aids, and treatments under the Head & Shoulders, Herbal Essences, Pantene, and Rejoice brands; antiperspirants, deodorants, and personal cleansing products under the Native, Old Spice, Safeguard, and Secret brands; and facial moisturizers, cleaners, and treatments under the Olay and SK-II brands. It also provides blades, razors, shave products, appliances, and other grooming products under the Braun, Gillette, and Venus brands. In addition, the company offers toothbrushes, toothpastes, and other oral care products under the Crest and Oral-B brands; and gastrointestinal, pain relief, rapid diagnostics, respiratory, vitamins/minerals/supplements, and other personal health care products under the Metamucil, Neurobion, Pepto-Bismol, and Vicks brands. Further, it provides fabric enhancers, and laundry additives and detergents under the Ariel, Downy, Gain, and Tide brands; and air and dish care, P&G professional, and surface care under the Cascade, Dawn, Fairy, Febreze, Mr. Clean, and Swiffer brands. Additionally, the company offers baby wipes, and taped diapers and pants under the Luvs and Pampers brands; adult incontinence and menstrual care products under the Always, Always Discreet, and Tampax brands; and paper towels, tissues, and toilet papers under the Bounty, Charmin, and Puffs brands. It sells its products through mass merchandisers, social and e-commerce channels, grocery and specialty beauty stores, membership club stores, drug and department stores, distributors, wholesalers, airport duty-free and high-frequency stores, pharmacies, electronics stores, and professional channels, as well as directly to consumers. The Procter & Gamble Company was founded in 1837 and is headquartered in Cincinnati, Ohio.",109000,"[{'maxAge': 1, 'name': 'Mr. Jon R. Moeller', 'age': 60, 'title': 'President, CEO & Chairman of the Board', 'yearBorn': 1964, 'fiscalYear': 2025, 'totalPay': 3827656, 'exercisedValue': 11551180, 'unexercisedValue': 13650635}, {'maxAge': 1, 'name': 'Mr. Andre  Schulten', 'age': 53, 'title': 'Chief Financial Officer', 'yearBorn': 1971, 'fiscalYear': 2025, 'totalPay': 1824131, 'exercisedValue': 0, 'unexercisedValue': 6001604}, {'maxAge': 1, 'name': 'Mr. Shailesh G. Jejurikar', 'age': 57, 'title': 'Chief Operating Officer', 'yearBorn': 1967, 'fiscalYear': 2025, 'totalPay': 2118211, 'exercisedValue': 0, 'unexercisedValue': 25970436}, {'maxAge': 1, 'name': 'Ms. Jennifer L. Davis', 'age': 53, 'title': 'Chief Executive Officer of Health Care', 'yearBorn': 1971, 'fiscalYear': 2025, 'totalPay': 1734433, 'exercisedValue': 0, 'unexercisedValue': 7203285}, {'maxAge': 1, 'name': 'Mr. Sundar G. Raman', 'age': 49, 'title': 'Chief Executive Officer of Fabric & Home Care', 'yearBorn': 1975, 'fiscalYear': 2025, 'totalPay': 2731833, 'exercisedValue': 0, 'unexercisedValue': 7282699}, {'maxAge': 1, 'name': 'Mr. Matthew W. Janzaruk', 'age': 50, 'title': 'Senior VP & Chief Accounting Officer', 'yearBorn': 1974, 'fiscalYear': 2025, 'exercisedValue': 0, 'unexercisedValue': 0}, {'maxAge': 1, 'name': 'Mr. Seth  Cohen', 'title': 'Chief Information Officer', 'fiscalYear': 2025, 'exercisedValue': 0, 'unexercisedValue': 0}, {'maxAge': 1, 'name': 'Mr. John T. Chevalier', 'title': 'Senior Vice President of Investor Relations', 'fiscalYear': 2025, 'exercisedValue': 0, 'unexercisedValue': 0}, {'maxAge': 1, 'name': 'Ms. Susan Street Whaley', 'age': 50, 'title': 'Chief Legal Officer & Secretary', 'yearBorn': 1974, 'fiscalYear': 2025, 'exercisedValue': 0, 'unexercisedValue': 0}, {'maxAge': 1, 'name': 'Mr. Damon D. Jones', 'age': 48, 'title': 'Chief Communications Officer', 'yearBorn': 1976, 'fiscalYear': 2025, 'exercisedValue': 0, 'unexercisedValue': 0}]",7,4,1,5,2,1756684800,1767139200,http://www.pg.com/en_US/investors/index.shtml,[],86400,2,156.83,157.135,156.89,158.39,156.83,157.135,156.89,158.39,4.23,2.7,1752796800,0.62619996,2.41,0.362,24.278034,21.300539,4506100,4506100,7839616,6253540,6253540,158.17,158.39,1,2,3.70E+11,149.91,180.43,4.388905,156.2172,163.8675,4.076,0.025989927,USD,FALSE,3.98E+11,0.18952999,2338178643,2340489984,17250036,16835373,1753920000,1756425600,0.0074,0.00069,0.70214,2.42,0.0074,2356450048,21.877,7.224482,1751241600,1782777600,1751241600,0.152,15683000320,6.51,7.42,2:01,1087776000,4.725,16.284,-0.10831249,0.17405021,1.057,1752796800,EQUITY,158.05,186,147,170.95454,174.5,2.04167,buy,22,9555999744,4.08,24455000064,36525998080,0.437,0.704,84283998208,69.861,35.864,0.10909,0.31242,43270000640,11380124672,17816999936,0.165,0.017,0.51338,0.29015,0.25147,USD,PG,en-US,US,Equity,Nasdaq Real Time Price,TRUE,HIGH,POST,0,158.05,0,1.22,156.89 - 158.39,NYSE,7839616,8.139999,0.05429924,149.91 - 180.43,-22.37999,-0.12403697,-10.831249,1755216000,1761309000,[],1758065430,1758052802,NYQ,finmb_33328,America/New_York,EDT,-14400000,us_market,FALSE,0.777913,158.05,Procter & Gamble Company (The),The Procter & Gamble Company,1761309000,1761309000,1761309000,1761309000,FALSE,6.51,7.42,6.99065,22.60877,1.8328094,0.011732444,-5.8174896,-0.035501182,15,0,,TRUE,-2.52E+11,,2.0 - Buy,FALSE,,4.7669,,,,
BAC,25,Bank of America Corporate Center,Charlotte,NC,28255,United States,(704) 386-5681,https://www.bankofamerica.com,Banks - Diversified,banks-diversified,Banks - Diversified,Financial Services,financial-services,Financial Services,"Bank of America Corporation, through its subsidiaries, provides various financial products and services for individual consumers, small and middle-market businesses, institutional investors, large corporations, and governments worldwide. The company operates through four segments: Consumer Banking, Global Wealth & Investment Management (GWIM), Global Banking, and Global Markets. The Consumer Banking segment offers traditional and money market savings accounts, certificates of deposit and IRAs, checking accounts, and investment accounts and products; credit and debit cards; residential mortgages and home equity loans; and direct and indirect loans, such as automotive, recreational vehicle, and consumer personal loans. The GWIM segment provides investment management, brokerage, banking, and trust and retirement products and services; wealth management solutions; and customized solutions, including specialty asset management services. The Global Banking segment offers lending products and services, including commercial loans, leases, commitment facilities, trade finance, and commercial real estate and asset-based lending; treasury solutions, such as treasury management, foreign exchange, short-term investing options, and merchant services; working capital management solutions; debt and equity underwriting and distribution, and merger-related and other advisory services; and fixed-income and equity research services. The Global Markets segment provides market-making, financing, securities clearing, settlement, and custody services; securities and derivative products; and risk management products using interest rate, equity, credit, currency and commodity derivatives, foreign exchange, fixed-income, and mortgage-related products. Bank of America Corporation was founded in 1784 and is based in Charlotte, North Carolina.",213000,"[{'maxAge': 1, 'name': 'Mr. Brian Thomas Moynihan', 'age': 65, 'title': 'Chairman & CEO', 'yearBorn': 1959, 'fiscalYear': 2024, 'totalPay': 2083090, 'exercisedValue': 0, 'unexercisedValue': 0}, {'maxAge': 1, 'name': 'Mr. Thomas M. Scrivener', 'age': 52, 'title': 'Chief Operations Executive', 'yearBorn': 1972, 'fiscalYear': 2024, 'exercisedValue': 0, 'unexercisedValue': 0}, {'maxAge': 1, 'name': 'Mr. Johnbull E. Okpara', 'age': 52, 'title': 'Chief Accounting Officer', 'yearBorn': 1972, 'fiscalYear': 2024, 'exercisedValue': 0, 'unexercisedValue': 0}, {'maxAge': 1, 'name': 'Mr. Hari  Gopalkrishnan', 'title': 'Chief Technology & Information Officer', 'fiscalYear': 2024, 'exercisedValue': 0, 'unexercisedValue': 0}, {'maxAge': 1, 'name': 'Mr. E. Lee McEntire', 'title': 'Head of Investor Relations & Local Markets Organization', 'fiscalYear': 2024, 'exercisedValue': 0, 'unexercisedValue': 0}, {'maxAge': 1, 'name': 'Ms. Lauren A. Mogensen J.D.', 'age': 61, 'title': 'Global General Counsel', 'yearBorn': 1963, 'fiscalYear': 2024, 'exercisedValue': 0, 'unexercisedValue': 0}, {'maxAge': 1, 'name': 'Amy  Littman', 'title': 'Co-Head of Global Compliance & Operational Risk and Head of Enterprise Reputational Risk', 'fiscalYear': 2024, 'exercisedValue': 0, 'unexercisedValue': 0}, {'maxAge': 1, 'name': 'Debbie U. Helvig', 'title': 'Head of Corporate Communications', 'fiscalYear': 2024, 'exercisedValue': 0, 'unexercisedValue': 0}, {'maxAge': 1, 'name': 'Mr. Robert  Gridley', 'title': 'SVP, Corporate Development', 'fiscalYear': 2024, 'exercisedValue': 0, 'unexercisedValue': 0}, {'maxAge': 1, 'name': 'Mr. David C. Tyrie', 'title': 'President of Mkt., Digital, Spec Consumer Client Sol, Chief Digital Off & Head of Global Marketing', 'fiscalYear': 2024, 'exercisedValue': 0, 'unexercisedValue': 0}]",6,5,10,2,8,1756684800,1735603200,http://investor.bankofamerica.com/phoenix.zhtml?c=71595&p=irol-sec,[],86400,2,50.59,50.64,50.21,50.875,50.59,50.64,50.21,50.875,1.12,2.21,1757030400,0.305,2.39,1.345,14.856304,13.84153,24523899,24523899,38735772,37067110,37067110,50.68,50.67,45,37,3.75E+11,33.07,51.09,3.8112442,48.133,44.8755,1.04,0.020557422,USD,FALSE,3.80E+11,0.28514,7378874982,7406949888,97853200,92234718,1753920000,1756425600,0.013200001,0.08289,0.6728,2.84,0.013200001,7406949888,37.127,1.3645056,1735603200,1767139200,1751241600,0.032,26594000896,3.41,3.66,2:01,1093824000,3.858,,0.27914035,0.17405021,0.28,1757030400,EQUITY,50.66,60,46,53.6875,54,1.6,buy,24,8.38E+11,113.156,,8.19E+11,,,98455003136,,12.78,0.00838,0.0946,98455003136,,-22677999616,0.072,0.042,0,0,0.30912,USD,BAC,en-US,US,Equity,Nasdaq Real Time Price,TRUE,HIGH,POST,0.11843935,50.72,0.060001373,0.0699997,50.21 - 50.875,NYSE,38735772,17.59,0.531902,33.07 - 51.09,-0.4300003,-0.008416526,27.914036,1758844800,1760531400,[],1758065479,1758052802,NYQ,finmb_19049,America/New_York,EDT,-14400000,us_market,FALSE,0.138367,50.66,Bank of America Corporation,Bank of America Corporation,1760531400,1760531400,1760531400,1760531400,FALSE,3.41,3.66,3.67019,13.8031,2.5270004,0.052500375,5.7845,0.12890108,15,0,,TRUE,99153000000,,1.6 - Buy,FALSE,Bank of America,1.2663,,100 North Tryon Street,,
CVX,26,1400 Smith Street,Houston,TX,77002-7327,United States,832 854 1000,https://www.chevron.com,Oil & Gas Integrated,oil-gas-integrated,Oil & Gas Integrated,Energy,energy,Energy,"Chevron Corporation, through its subsidiaries, engages in the integrated energy and chemicals operations in the United States and internationally. The company operates in two segments, Upstream and Downstream. The Upstream segment engages in the exploration, development, production, and transportation of crude oil and natural gas; liquefaction, transportation, and regasification of liquefied natural gas; transporting crude oil through pipelines; processing, transporting, storage, and marketing of natural gas; and carbon capture and storage, as well as a gas-to-liquids plant. The Downstream segment refines crude oil into petroleum products; markets crude oil, refined products, and lubricants; manufactures and markets renewable fuels; transports crude oil and refined products through pipeline, marine vessel, motor equipment, and rail car; and manufactures and markets commodity petrochemicals, plastics for industrial uses, and fuel and lubricant additives. The company was formerly known as ChevronTexaco Corporation and changed its name to Chevron Corporation in 2005. Chevron Corporation was founded in 1879 and is headquartered in Houston, Texas.",45298,"[{'maxAge': 1, 'name': 'Mr. Michael K. Wirth', 'age': 63, 'title': 'Chairman & CEO', 'yearBorn': 1961, 'fiscalYear': 2024, 'totalPay': 7339719, 'exercisedValue': 9286172, 'unexercisedValue': 57697012}, {'maxAge': 1, 'name': 'Ms. Eimear P. Bonner', 'age': 49, 'title': 'VP & Chief Financial Officer', 'yearBorn': 1975, 'fiscalYear': 2024, 'totalPay': 3071247, 'exercisedValue': 0, 'unexercisedValue': 2124545}, {'maxAge': 1, 'name': 'Mr. R. Hewitt Pate J.D.', 'age': 61, 'title': 'VP & General Counsel', 'yearBorn': 1963, 'fiscalYear': 2024, 'totalPay': 3046781, 'exercisedValue': 0, 'unexercisedValue': 7943180}, {'maxAge': 1, 'name': 'Mr. Mark A. Nelson', 'age': 61, 'title': 'Vice Chairman & Executive VP of Oil, Products and Gas', 'yearBorn': 1963, 'fiscalYear': 2024, 'totalPay': 3469057, 'exercisedValue': 0, 'unexercisedValue': 10674103}, {'maxAge': 1, 'name': 'Mr. T. Ryder Booth', 'title': 'VP of Technology, Projects & Execution', 'fiscalYear': 2024, 'exercisedValue': 0, 'unexercisedValue': 0}, {'maxAge': 1, 'name': 'Jake Robert Spiering', 'title': 'General Manager of Investor Relations', 'fiscalYear': 2024, 'exercisedValue': 0, 'unexercisedValue': 0}, {'maxAge': 1, 'name': 'Ms. Michelle R. Green', 'age': 52, 'title': 'VP & Chief Human Resources Officer', 'yearBorn': 1972, 'fiscalYear': 2024, 'exercisedValue': 0, 'unexercisedValue': 0}, {'maxAge': 1, 'name': 'Mr. Clay  Neff', 'age': 62, 'title': 'President of Upstream', 'yearBorn': 1962, 'fiscalYear': 2024, 'exercisedValue': 0, 'unexercisedValue': 0}, {'maxAge': 1, 'name': 'Mr. Bruce L. Niemeyer', 'age': 62, 'title': 'President of Shale & Tight', 'yearBorn': 1962, 'fiscalYear': 2024, 'exercisedValue': 0, 'unexercisedValue': 0}, {'maxAge': 1, 'name': 'Mr. Jeff B. Gustavson', 'age': 51, 'title': 'President of Chevron New Energies & VP of Lower Carbon Energies', 'yearBorn': 1973, 'fiscalYear': 2024, 'exercisedValue': 0, 'unexercisedValue': 0}]",9,3,2,2,2,1756684800,1735603200,http://investor.chevron.com/phoenix.zhtml?c=130102&p=irol-irhome,[],86400,2,157.31,158.25,158.12,160.0955,157.31,158.25,158.12,160.0955,6.84,4.35,1755561600,0.8597,4.3,0.874,20.532818,14.451086,7942587,7942587,9856040,7842340,7842340,159.5,159.9,1,4,3.21E+11,132.04,168.96,1.6983824,154.6056,150.58105,6.68,0.042463925,USD,FALSE,3.02E+11,0.07247,1613476454,2014819968,18117914,18661705,1753920000,1756425600,0.009,0.060300004,0.58976,2.24,0.009,2014819968,84.733,1.8828554,1735603200,1767139200,1751241600,-0.438,13715999744,7.77,11.04,2:01,1095033600,1.595,8.246,0.0969249,0.17405021,1.71,1755561600,EQUITY,159.54,197,124,169.43478,170,2.16,buy,23,4065999872,2.353,36614000640,29467000832,0.62,0.996,1.89E+11,20.01,107.606,0.04756,0.08963,74136002560,14433874944,32134000640,-0.404,-0.107,0.39169997,0.19344999,0.09441,USD,CVX,en-US,US,Equity,Nasdaq Real Time Price,TRUE,HIGH,POST,0.15971325,159.7948,0.25480652,2.23,158.12 - 160.0955,NYSE,9856040,27.5,0.20827024,132.04 - 168.96,-9.420013,-0.055752918,9.69249,1757462400,1754051400,[],1758065457,1758052999,NYQ,finmb_98506,America/New_York,EDT,-14400000,us_market,FALSE,1.41758,159.54,Chevron Corporation,Chevron Corporation,1761913800,1761913800,1754060400,1754060400,TRUE,7.77,11.04,7.83696,20.357384,4.934387,0.031915966,8.958939,0.059495788,15,0,,TRUE,-2.52E+11,,2.2 - Buy,FALSE,Chevron,3.9097,,,,
KO,27,One Coca-Cola Plaza,Atlanta,GA,30313,United States,404 676 2121,https://www.coca-colacompany.com,Beverages - Non-Alcoholic,beverages-non-alcoholic,Beverages - Non - Alcoholic,Consumer Defensive,consumer-defensive,Consumer Defensive,"The Coca-Cola Company, a beverage company, manufactures and sells various nonalcoholic beverages in the United States and internationally. The company provides sparkling soft drinks and flavors; water, sports, coffee, and tea; juice, value-added dairy, and plant-based beverages; and other beverages. It also offers beverage concentrates and syrups, as well as fountain syrups to fountain retailers comprising restaurants and convenience stores. The company sells its products under the Coca-Cola, Diet Coke/Coca-Cola Light, Coca-Cola Zero Sugar, caffeine free Diet Coke, Cherry Coke, Fanta Orange, Fanta Zero Orange, Fanta Zero Sugar, Fanta Apple, Sprite, Sprite Zero Sugar, Simply Orange, Simply Apple, Simply Grapefruit, Fresca, Schweppes, Thums Up, Aquarius, Ayataka, BODYARMOR, Ciel, Costa, Crystal, Dasani, dogadan, Fuze Tea, Georgia, glacau smartwater, glacau vitaminwater, Gold Peak, I LOHAS, Powerade, Topo Chico, Core Power, Del Valle, fairlife, innocent, Maaza, Minute Maid, Minute Maid Pulpy, and Simply brands. It operates through a network of independent bottling partners, distributors, wholesalers, and retailers, as well as through bottling and distribution operators. The company was founded in 1886 and is headquartered in Atlanta, Georgia.",69700,"[{'maxAge': 1, 'name': 'Mr. James Robert B. Quincey', 'age': 59, 'title': 'Chairman & CEO', 'yearBorn': 1965, 'fiscalYear': 2024, 'totalPay': 8868306, 'exercisedValue': 4077817, 'unexercisedValue': 35975472}, {'maxAge': 1, 'name': 'Mr. John  Murphy', 'age': 62, 'title': 'President & CFO', 'yearBorn': 1962, 'fiscalYear': 2024, 'totalPay': 4489605, 'exercisedValue': 1204753, 'unexercisedValue': 11168569}, {'maxAge': 1, 'name': 'Mr. Henrique  Braun', 'age': 56, 'title': 'EVP & Chief Operating Officer', 'yearBorn': 1968, 'fiscalYear': 2024, 'totalPay': 2888351, 'exercisedValue': 1214311, 'unexercisedValue': 4229513}, {'maxAge': 1, 'name': 'Mr. Manuel Arroyo Prieto', 'age': 57, 'title': 'Executive VP & Global chief Marketing Officer', 'yearBorn': 1967, 'fiscalYear': 2024, 'totalPay': 9554033, 'exercisedValue': 195832, 'unexercisedValue': 4816468}, {'maxAge': 1, 'name': 'Ms. Jennifer Kay Mann', 'age': 52, 'title': 'Executive VP & President of North America Operating Unit', 'yearBorn': 1972, 'fiscalYear': 2024, 'totalPay': 2293472, 'exercisedValue': 3370630, 'unexercisedValue': 2234684}, {'maxAge': 1, 'name': 'Ms. Erin L. May', 'age': 44, 'title': 'Senior VP, Chief Accounting Officer & Controller', 'yearBorn': 1980, 'fiscalYear': 2024, 'exercisedValue': 0, 'unexercisedValue': 0}, {'maxAge': 1, 'name': 'Ms. Stacy Lynn  Apter', 'age': 58, 'title': 'Senior VP, Treasurer & Head of Corporate Finance', 'yearBorn': 1966, 'fiscalYear': 2024, 'exercisedValue': 0, 'unexercisedValue': 0}, {'maxAge': 1, 'name': 'Ms. Nancy W. Quan', 'age': 58, 'title': 'Executive VP and Global Chief Technical & Innovation Officer', 'yearBorn': 1966, 'fiscalYear': 2024, 'exercisedValue': 0, 'unexercisedValue': 0}, {'maxAge': 1, 'name': 'Mr. Neeraj S. Tolmare', 'age': 50, 'title': 'Senior VP & Chief Information Officer', 'yearBorn': 1974, 'fiscalYear': 2024, 'exercisedValue': 0, 'unexercisedValue': 0}, {'maxAge': 1, 'name': 'Ms. Robin  Halpern', 'title': 'VP & Head of Investor Relations', 'fiscalYear': 2024, 'exercisedValue': 0, 'unexercisedValue': 0}]",2,7,1,4,2,1756684800,1735603200,http://www.coca-colacompany.com/investors/,[],86400,2,66.21,66.35,66.055,66.51,66.21,66.35,66.055,66.51,2.04,3.08,1757894400,0.7057,2.95,0.43,23.48936,22.30303,13009551,13009551,16226677,20071210,20071210,66.29,66.3,11,24,2.85E+11,60.62,74.38,6.0574365,69.2304,68.37365,1.99,0.030055884,USD,FALSE,3.23E+11,0.25887,3870761363,4303669760,36843168,35369678,1753920000,1756425600,0.0086,0.09879,0.65599996,2.81,0.0086,4303669760,6.641,9.974401,1735603200,1767139200,1750982400,0.58,12183000064,2.82,2.97,2:01,1344816000,6.855,20.429,-0.07785517,0.17405021,0.51,1757894400,EQUITY,66.24,85,70,78.53043,80,1.6,buy,23,14296999936,3.322,15790999552,50212999168,0.841,1.213,47061999616,166.367,10.929,0.08941,0.42369998,28907999232,1707124992,1300999936,0.573,0.014,0.61425,0.33554,0.34662998,USD,KO,en-US,US,Equity,Nasdaq Real Time Price,TRUE,HIGH,POST,0.09058754,66.3,0.060005188,0.0299988,66.055 - 66.51,NYSE,16226677,5.619999,0.09270866,60.62 - 74.38,-8.139999,-0.10943802,-7.7855167,1759276800,1753187400,"[{'header': 'Dividend', 'message': 'KO announced a cash dividend of 0.51 with an ex-date of Sep. 15, 2025', 'meta': {'eventType': 'DIVIDEND', 'dateEpochMs': 1757908800000, 'amount': '0.51'}}]",1758065485,1758052802,NYQ,finmb_26642,America/New_York,EDT,-14400000,us_market,FALSE,0.0453085,66.24,Coca-Cola Company (The),The Coca-Cola Company,1761049800,1761049800,1753187400,1753187400,TRUE,2.82,2.97,2.98106,22.220284,-2.9904022,-0.043194927,-2.1336517,-0.03120576,15,0,,TRUE,-2.52E+11,,1.6 - Buy,FALSE,Coca-Cola,2.2041,,,,
