T,46,208 South Akard Street,Dallas,TX,75202,United States,210 821 4105,https://www.att.com,Telecom Services,telecom-services,Telecom Services,Communication Services,communication-services,Communication Services,"AT&T Inc. provides telecommunications and technology services worldwide. The company operates through two segments, Communications and Latin America. The Communications segment offers wireless voice and data communications services; and sells handsets, wireless data cards, wireless computing devices, carrying cases/protective covers, and wireless chargers through its own company-owned stores, agents, and third-party retail stores. It also provides AT&T Dedicated Internet, fiber ethernet and broadband, fixed wireless, and hosted and managed professional services; and copper-based voice and data, Virtual Private Networks (VPN), wholesale, outsourcing, and IP, as well as customer premises equipment for multinational corporations, small and mid-sized businesses, governmental, and wholesale customers. In addition, this segment offers broadband services, including fiber connections, legacy telephony voice communication services, and other VoIP services and equipment to residential customers. This segment markets its communications services and products under the AT&T, AT&T Business, Cricket, AT&T PREPAID, AT&T Fiber, and AT&T Internet Air brand names. The Latin America segment provides postpaid and prepaid wireless services in Mexico under the AT&T and Unefon brand names, as well as sells smartphones through its stores, agents and third-party retail stores. The company was formerly known as SBC Communications Inc. and changed its name to AT&T Inc. in 2005. AT&T Inc. was incorporated in 1983 and is based in Dallas, Texas.",137550,"[{'maxAge': 1, 'name': 'Mr. John T. Stankey', 'age': 61, 'title': 'CEO & Chairman', 'yearBorn': 1963, 'fiscalYear': 2024, 'totalPay': 8705507, 'exercisedValue': 0, 'unexercisedValue': 0}, {'maxAge': 1, 'name': 'Mr. Pascal  Desroches CPA', 'age': 60, 'title': 'Senior EVP & CFO', 'yearBorn': 1964, 'fiscalYear': 2024, 'totalPay': 4977127, 'exercisedValue': 0, 'unexercisedValue': 0}, {'maxAge': 1, 'name': 'Mr. Jeffery Scott McElfresh', 'age': 54, 'title': 'Chief Operating Officer', 'yearBorn': 1970, 'fiscalYear': 2024, 'totalPay': 4358259, 'exercisedValue': 0, 'unexercisedValue': 0}, {'maxAge': 1, 'name': 'Mr. David R. McAtee II', 'age': 55, 'title': 'Senior EVP & General Counsel', 'yearBorn': 1969, 'fiscalYear': 2024, 'totalPay': 4440189, 'exercisedValue': 0, 'unexercisedValue': 0}, {'maxAge': 1, 'name': 'Ms. Lori M. Lee', 'age': 58, 'title': 'Global Marketing Officer and Senior EVP of International & Human Resources', 'yearBorn': 1966, 'fiscalYear': 2024, 'totalPay': 2442593, 'exercisedValue': 0, 'unexercisedValue': 0}, {'maxAge': 1, 'name': 'Ms. Sabrina  Sanders', 'age': 45, 'title': 'Senior VP, Chief Accounting Officer & Controller', 'yearBorn': 1979, 'fiscalYear': 2024, 'exercisedValue': 0, 'unexercisedValue': 0}, {'maxAge': 1, 'name': 'Mr. Brett Joseph Feldman', 'title': 'Senior Vice President of Finance & Investor Relations', 'fiscalYear': 2024, 'exercisedValue': 0, 'unexercisedValue': 0}, {'maxAge': 1, 'name': 'Mr. Larry  Solomon', 'title': 'Chief Communications Officer', 'fiscalYear': 2024, 'exercisedValue': 0, 'unexercisedValue': 0}, {'maxAge': 1, 'name': 'Mr. Rick  Moore', 'age': 72, 'title': 'Senior Vice President of Corporate Development', 'yearBorn': 1952, 'fiscalYear': 2024, 'exercisedValue': 0, 'unexercisedValue': 0}, {'maxAge': 1, 'name': 'Ms. Kellyn Smith Kenny M.B.A.', 'age': 46, 'title': 'Chief Marketing & Growth Officer', 'yearBorn': 1978, 'fiscalYear': 2024, 'exercisedValue': 0, 'unexercisedValue': 0}]",1,5,6,3,3,1756684800,1735603200,http://www.att.com/gen/landing-pages?pid=5718,[],86400,2,29.62,29.62,29.21,29.645,29.62,29.62,29.21,29.645,1.11,3.75,1752105600,0.6343,6.74,0.639,16.76,13.09375,28043486,28043486,31410085,29506960,29506960,29.3,29.4,127,97,2.10E+11,21.05,29.79,1.691516,28.3156,26.4843,1.11,0.037474677,USD,FALSE,3.69E+11,0.10288999,7136442228,7150389760,89142504,93449339,1753920000,1756425600,0.0125,0.00084,0.66678,2.97,0.0125,7150389760,14.7,1.9952381,1735603200,1767139200,1751241600,0.251,12664000512,1.75,2.24,1324:1000,1649635200,2.979,8.279,0.3599633,0.17405021,0.278,1752105600,EQUITY,29.33,34,21.87,30.6248,31.5,1.96296,buy,25,10499000320,1.468,44610998272,1.52E+11,0.506,0.809,1.24E+11,123.191,17.202,0.04167,0.11529,73975996416,12400000000,40943001600,0.263,0.035,0.59666,0.35981,0.22725001,USD,T,en-US,US,Equity,Nasdaq Real Time Price,TRUE,HIGH,POST,0.10228669,29.36,0.030000687,-0.290001,29.21 - 29.645,NYSE,31410085,8.280001,0.39334923,21.05 - 29.79,-0.460001,-0.015441456,35.99633,1754006400,1761136200,[],1758065503,1758053005,NYQ,finmb_100231,America/New_York,EDT,-14400000,us_market,FALSE,-0.979071,29.33,AT&T Inc.,AT&T Inc.,1761136200,1761136200,1761136200,1761136200,FALSE,1.75,2.24,2.05407,14.278968,1.0144005,0.035824794,2.8456993,0.10744853,15,0,,TRUE,4.38E+11,,2.0 - Buy,FALSE,AT&T,1.0799,,,,
RTX,47,1000 Wilson Boulevard,Arlington,VA,22209,United States,781 522 3000,https://www.rtx.com,Aerospace & Defense,aerospace-defense,Aerospace & Defense,Industrials,industrials,Industrials,"RTX Corporation, an aerospace and defense company, provides systems and services for the commercial, military, and government customers in the United States and internationally. It operates through three segments: Collins Aerospace, Pratt & Whitney, and Raytheon. The Collins Aerospace Systems segment offers aerospace and defense products, and aftermarket service solutions for civil and military aircraft manufacturers and commercial airlines, as well as regional, business, and general aviation, defense, and commercial space operations. This segment also designs, produces, and supports cabin interior, including seating, oxygen systems, food and beverage preparation, storage and galley systems, and lavatory and wastewater management systems; battlespace, test and training range systems, crew escape systems, and simulation and training solutions; information management services; and aftermarket services that include spare parts, overhaul and repair, engineering and technical support, training and fleet management solutions, and asset and information management services. The Pratt & Whitney segment supplies aircraft engines for commercial, military, business jet, and general aviation customers; and produces, sells, and services military and commercial auxiliary power units. The Raytheon segment provides defensive and offensive threat detection, tracking, and mitigation capabilities for government, and commercial customers. The company was formerly known as Raytheon Technologies Corporation and changed its name to RTX Corporation in July 2023. RTX Corporation was incorporated in 1934 and is headquartered in Arlington, Virginia.",186000,"[{'maxAge': 1, 'name': 'Mr. Christopher T. Calio', 'age': 50, 'title': 'Chairman & CEO', 'yearBorn': 1974, 'fiscalYear': 2024, 'totalPay': 4310200, 'exercisedValue': 516555, 'unexercisedValue': 8149284}, {'maxAge': 1, 'name': 'Mr. Neil G. Mitchill Jr.', 'age': 48, 'title': 'Executive VP & CFO', 'yearBorn': 1976, 'fiscalYear': 2024, 'totalPay': 2767233, 'exercisedValue': 641396, 'unexercisedValue': 5824109}, {'maxAge': 1, 'name': 'Mr. Shane G. Eddy', 'age': 58, 'title': 'President of Pratt & Whitney', 'yearBorn': 1966, 'fiscalYear': 2024, 'totalPay': 1911284, 'exercisedValue': 41528, 'unexercisedValue': 5699241}, {'maxAge': 1, 'name': 'Mr. Philip J. Jasper', 'age': 56, 'title': 'President of Raytheon', 'yearBorn': 1968, 'fiscalYear': 2024, 'totalPay': 1849611, 'exercisedValue': 0, 'unexercisedValue': 3719242}, {'maxAge': 1, 'name': 'Mr. Troy D. Brunk', 'age': 54, 'title': 'President of Collins Aerospace', 'yearBorn': 1970, 'fiscalYear': 2024, 'totalPay': 1272602, 'exercisedValue': 656321, 'unexercisedValue': 299205}, {'maxAge': 1, 'name': 'Ms. Robin L. Diamonte', 'age': 59, 'title': 'Chief Investment Officer & VP of Pension Investments', 'yearBorn': 1965, 'fiscalYear': 2024, 'exercisedValue': 0, 'unexercisedValue': 0}, {'maxAge': 1, 'name': 'Ms. Amy L. Johnson', 'age': 48, 'title': 'Corporate VP & Controller', 'yearBorn': 1976, 'fiscalYear': 2024, 'exercisedValue': 0, 'unexercisedValue': 0}, {'maxAge': 1, 'name': 'Mr. Juan M. de Bedout', 'title': 'Chief Technology Officer', 'fiscalYear': 2024, 'exercisedValue': 0, 'unexercisedValue': 0}, {'maxAge': 1, 'name': 'Mr. Ramsaran  Maharajh Jr.', 'age': 52, 'title': 'Executive VP & General Counsel', 'yearBorn': 1972, 'fiscalYear': 2024, 'exercisedValue': 0, 'unexercisedValue': 0}, {'maxAge': 1, 'name': 'Ms. Pamela M. Erickson', 'title': 'Chief Communications Officer', 'fiscalYear': 2024, 'exercisedValue': 0, 'unexercisedValue': 0}]",5,6,1,2,2,1756684800,1735603200,http://www.utc.com/Investor+Relations,[],86400,2,158.37,159.85,157.64,159.95,158.37,159.85,157.64,159.95,2.72,1.72,1755216000,0.5648,2.37,0.662,34.852745,25.954174,4812233,4812233,4755917,4014430,4014430,158.78,158.81,3,7,2.12E+11,112.27,161.26,2.5390935,154.6072,134.8609,2.57,0.01622782,USD,FALSE,2.53E+11,0.073520005,1223373688,1338540032,16179338,14206486,1753920000,1756425600,0.0121,0.00079,0.83338,4.15,0.0121,1338540032,46.616,3.4018362,1735603200,1767139200,1751241600,13.928,6145999872,4.55,6.11,15890:10000,1585872000,3.022,17.96,0.33386672,0.17405021,0.68,1755216000,EQUITY,158.58,180,134,164.57895,172,1.9,buy,19,4782000128,3.573,14067000320,43595001856,0.605,1.006,83598999552,67.855,62.562,0.03695,0.10318,16760999936,2800750080,5847000064,14.25,0.094,0.20049,0.16826999,0.11547,USD,RTX,en-US,US,Equity,Nasdaq Real Time Price,TRUE,HIGH,POST,-0.050448876,158.5,-0.08000183,0.210007,157.64 - 159.95,NYSE,4755917,46.310005,0.4124878,112.27 - 161.26,-2.6799927,-0.016619079,33.386673,1756944000,1753187400,[],1758065095,1758052802,NYQ,finmb_159230,America/New_York,EDT,-14400000,us_market,FALSE,0.132605,158.58,RTX Corporation,RTX Corporation,1753187400,1753187400,1753187400,1753187400,FALSE,4.55,6.11,5.95795,26.616537,3.9728088,0.025696145,23.7191,0.17587826,15,0,Raytheon Technologies Corporation,TRUE,-2.45E+11,9/12/2025,1.9 - Buy,FALSE,RTX,1.4009,,,,
PEP,48,700 Anderson Hill Road,Purchase,NY,10577,United States,(914) 253-2000,https://www.pepsico.com,Beverages - Non-Alcoholic,beverages-non-alcoholic,Beverages - Non - Alcoholic,Consumer Defensive,consumer-defensive,Consumer Defensive,"PepsiCo, Inc. engages in the manufacture, marketing, distribution, and sale of various beverages and convenient foods worldwide. The company operates through seven segments: Frito-Lay North America; Quaker Foods North America; PepsiCo Beverages North America; Latin America; Europe; Africa, Middle East and South Asia; and Asia Pacific, Australia and New Zealand and China Region. It provides dips, cheese-flavored snacks, and spreads, as well as corn, potato, and tortilla chips; cereals, rice, pasta, mixes and syrups, granola bars, grits, oatmeal, rice cakes, and side dishes; beverage concentrates, fountain syrups, and finished goods; ready-to-drink tea, coffee, and juices; dairy products; and sparkling water makers and related products, as well as distributes alcoholic beverages under Hard MTN Dew brand. The company offers its products primarily under the Lay's, Doritos, Fritos, Tostitos, BaiCaoWei, Cheetos, Cap'n Crunch, Life, Pearl Milling Company, Gatorade, Pepsi-Cola, Mountain Dew, Quaker, Rice-A-Roni, Aquafina, Bubly, Emperador, Diet Mountain Dew, Diet Pepsi, Gatorade Zero, Crush, Propel, Dr Pepper, Schweppes, Marias Gamesa, Ruffles, Sabritas, Saladitas, Tostitos, 7UP, Diet 7UP, H2oh!, Manzanita Sol, Mirinda, Pepsi Black, Pepsi Max, San Carlos, Toddy, Walkers, Chipsy, Kurkure, Sasko, Spekko, White Star, Smith's, Sting, SodaStream, Lubimyj Sad, Agusha, Chudo, Domik v Derevne, Lipton, and other brands. It serves wholesale and other distributors, foodservice customers, grocery stores, drug stores, convenience stores, discount/dollar stores, mass merchandisers, membership stores, hard discounters, e-commerce retailers and authorized independent bottlers, and others through a network of direct-store-delivery, customer warehouse, and distributor networks, as well as directly to consumers through e-commerce platforms and retailers. The company was founded in 1898 and is based in Purchase, New York.",319000,"[{'maxAge': 1, 'name': 'Mr. Ramon Luis Laguarta', 'age': 60, 'title': 'Chairman & CEO', 'yearBorn': 1964, 'fiscalYear': 2024, 'totalPay': 9067946, 'exercisedValue': 0, 'unexercisedValue': 0}, {'maxAge': 1, 'name': 'Mr. James T. Caulfield', 'age': 64, 'title': 'Executive VP & CFO', 'yearBorn': 1960, 'fiscalYear': 2024, 'totalPay': 1599042, 'exercisedValue': 0, 'unexercisedValue': 566557}, {'maxAge': 1, 'name': 'Ms. Rebecca  Schmitt', 'age': 50, 'title': 'Executive VP & Chief People Officer', 'yearBorn': 1974, 'fiscalYear': 2024, 'totalPay': 3556932, 'exercisedValue': 0, 'unexercisedValue': 0}, {'maxAge': 1, 'name': 'Mr. Silviu Yeugeniu Popovici', 'age': 56, 'title': 'Chief Executive Officer of EMEA', 'yearBorn': 1968, 'fiscalYear': 2024, 'totalPay': 3635662, 'exercisedValue': 0, 'unexercisedValue': 0}, {'maxAge': 1, 'name': 'Mr. Steven C. Williams', 'age': 58, 'title': 'Chief Executive Officer of North America', 'yearBorn': 1966, 'fiscalYear': 2024, 'totalPay': 2633948, 'exercisedValue': 0, 'unexercisedValue': 0}, {'maxAge': 1, 'name': 'Mr. Gregg  Roden', 'title': 'Executive VP & COO', 'fiscalYear': 2024, 'exercisedValue': 0, 'unexercisedValue': 0}, {'maxAge': 1, 'name': 'Dr. Rene  Lammers', 'title': 'Executive VP & Chief Science Officer', 'fiscalYear': 2024, 'exercisedValue': 0, 'unexercisedValue': 0}, {'maxAge': 1, 'name': 'Mr. David J. Flavell', 'age': 52, 'title': 'Executive VP, General Counsel & Corporate Secretary', 'yearBorn': 1972, 'fiscalYear': 2024, 'exercisedValue': 0, 'unexercisedValue': 0}, {'maxAge': 1, 'name': 'Ms. Jane Caroline Wakely', 'age': 52, 'title': 'Executive VP, Chief Consumer & Marketing Officer and Chief Growth Officer of International Foods', 'yearBorn': 1972, 'fiscalYear': 2024, 'exercisedValue': 0, 'unexercisedValue': 0}, {'maxAge': 1, 'name': 'Mr. Stephen  Kehoe', 'title': 'Executive VP & Chief Corporate Affairs Officer', 'fiscalYear': 2024, 'exercisedValue': 0, 'unexercisedValue': 0}]",8,4,3,3,3,1756684800,1735603200,http://www.pepsico.com/Investors.html,[],86400,2,140.64,140.745,139.91,141.31,140.64,140.745,139.91,141.31,5.69,4.05,1757030400,0.9995,2.9,0.467,25.55292,16.225956,9279040,9279040,9430198,8428010,8428010,139.96,140.31,1,6,1.92E+11,127.6,178.09,2.0895526,143.645,144.0159,5.488,0.039021615,USD,FALSE,2.35E+11,0.08229,1365367005,1369080064,22413180,22083299,1753920000,1756425600,0.0164,0.00188,0.79007006,2.84,0.0164,1369080064,13.444,10.415798,1735344000,1766880000,1749859200,-0.59,7550000128,5.48,8.63,2:01,833328000,2.564,13.815,-0.2048397,0.17405021,1.423,1757030400,EQUITY,140.03,170,115,153.59091,155.5,2.73913,hold,22,7973000192,5.824,17027999744,51384000512,0.559,0.775,91747999744,276.868,66.92,0.08514,0.39859,50171998208,7594375168,12188000256,-0.587,0.01,0.54685,0.1856,0.17491,USD,PEP,en-US,US,Equity,Nasdaq Real Time Price,TRUE,HIGH,POST,0.17139576,140.27,0.2400055,-0.6100006,139.91 - 141.31,NasdaqGS,9430198,12.43,0.09741379,127.6 - 178.09,-38.059998,-0.21371216,-20.48397,1759190400,1760013000,[],1758065299,1758052800,NMS,finmb_32854,America/New_York,EDT,-14400000,us_market,FALSE,-0.43373197,140.03,"Pepsico, Inc.","PepsiCo, Inc.",1760013000,1760013000,1760012100,1760012100,FALSE,5.48,8.63,8.02163,17.45655,-3.6150055,-0.025166245,-3.9859009,-0.027676811,15,0,,TRUE,76253400000,,2.7 - Hold,FALSE,PepsiCo,2.9028,,,,
INTU,49,2700 Coast Avenue,Mountain View,CA,94043,United States,650 944 6000,https://www.intuit.com,Software - Application,software-application,Software - Application,Technology,technology,Technology,"Intuit Inc. provides financial management, payments and capital, compliance, and marketing products and services in the United States. The company operates in four segments: Global Business Solutions, Consumer, Credit Karma, and ProTax. The SGlobal Business Solutions segment provides QuickBooks services, which include financial and business management online services, desktop software, payroll solutions, time tracking, merchant payment processing and bill pay solutions, checking accounts, and financing services for small and mid-market businesses; and Mailchimp, a marketing automation and customer relationship management. This segment also offers QuickBooks online services and desktop software solutions comprising QuickBooks Online, QuickBooks Live, QuickBooks Online Advanced, QuickBooks Self-Employed, QuickBooks Solopreneur financial and business management offerings, QuickBooks Online Payroll, QuickBooks Checking, QuickBooks Desktop software subscriptions, and QuickBooks Assisted Payroll. The Consumer segment provides do-it-yourself and assisted TurboTax income tax preparation products and services. The Credit Karma segment offers consumers with a personal finance platform that provides recommendations for credit card, home, auto, and personal loan, and insurance products; online savings and checking accounts; and access to its credit scores and reports, credit and identity monitoring, credit report dispute, credit building tools, and tools. The ProTax segment provides Lacerte, ProSeries, and ProFile desktop tax-preparation software products; and ProConnect Tax Online bill pay tax products, electronic tax filing service, and bank products and related services. It sells products and services through direct sales channels, multichannel shop-and-buy experiences, mobile application stores, and partner and other channels. Intuit Inc. was founded in 1983 and is headquartered in Mountain View, California.",18200,"[{'maxAge': 1, 'name': 'Mr. Sasan K. Goodarzi', 'age': 56, 'title': 'CEO, President & Director', 'yearBorn': 1968, 'fiscalYear': 2024, 'totalPay': 3674944, 'exercisedValue': 33899968, 'unexercisedValue': 78012712}, {'maxAge': 1, 'name': 'Mr. Scott D. Cook', 'age': 72, 'title': 'Founder & Director', 'yearBorn': 1952, 'fiscalYear': 2024, 'totalPay': 1267625, 'exercisedValue': 0, 'unexercisedValue': 0}, {'maxAge': 1, 'name': 'Mr. Sandeep Singh Aujla', 'age': 48, 'title': 'Executive VP & CFO', 'yearBorn': 1976, 'fiscalYear': 2024, 'totalPay': 1659100, 'exercisedValue': 2564749, 'unexercisedValue': 1841009}, {'maxAge': 1, 'name': 'Ms. Laura A. Fennell J.D.', 'age': 63, 'title': 'Executive Officer', 'yearBorn': 1961, 'fiscalYear': 2024, 'totalPay': 1657800, 'exercisedValue': 11149994, 'unexercisedValue': 22966648}, {'maxAge': 1, 'name': 'Mr. Mark  Notarainni', 'age': 54, 'title': 'Executive VP & GM of Consumer Group', 'yearBorn': 1970, 'fiscalYear': 2024, 'totalPay': 1425050, 'exercisedValue': 1639588, 'unexercisedValue': 6314023}, {'maxAge': 1, 'name': 'Ms. Marianna  Tessel', 'age': 57, 'title': 'Executive VP & GM of Small Business Group', 'yearBorn': 1967, 'fiscalYear': 2024, 'totalPay': 1660400, 'exercisedValue': 2729340, 'unexercisedValue': 31891824}, {'maxAge': 1, 'name': 'Ms. Lauren D. Hotz', 'age': 48, 'title': 'Senior VP & Chief Accounting Officer', 'yearBorn': 1976, 'fiscalYear': 2024, 'exercisedValue': 0, 'unexercisedValue': 0}, {'maxAge': 1, 'name': 'Mr. Alex G. Balazs', 'age': 53, 'title': 'Executive VP & CTO', 'yearBorn': 1971, 'fiscalYear': 2024, 'exercisedValue': 0, 'unexercisedValue': 0}, {'maxAge': 1, 'name': 'Ms. Kimberly Anderson Watkins CFA', 'title': 'Vice President of Investor Relations', 'fiscalYear': 2024, 'exercisedValue': 0, 'unexercisedValue': 0}, {'maxAge': 1, 'name': 'Ms. Kerry J. McLean J.D.', 'age': 60, 'title': 'Executive VP, General Counsel & Corporate Secretary', 'yearBorn': 1964, 'fiscalYear': 2024, 'exercisedValue': 0, 'unexercisedValue': 0}]",1,1,6,2,1,1756684800,1735603200,http://investors.intuit.com/,[],86400,2,651.33,649.37,644.46,655.11,651.33,649.37,644.46,655.11,4.32,0.66,1759968000,0.3043,0.58,1.26,47.609646,29.298246,1575005,1575005,1812269,1919330,1919330,612.75,677.98,1,1,1.82E+11,532.65,813.7,9.642913,725.1864,663.7639,4.16,0.006386931,USD,FALSE,,0.20546,272030039,278804992,4761374,4684100,1753920000,1756425600,0.0171,0.02568,0.89645,2.28,0.0175,279110016,70.613,9.223514,1753920000,1785456000,1627689600,-0.146,3868999936,13.68,22.23,2:01,1152230400,,,0.010095835,0.17405021,1.04,1752105600,EQUITY,651.3,971,600,819.7296,830.215,1.6129,buy,28,,,5591000064,,0.495,1.36,18830999552,,67.254,0.08934,0.20285,15139000320,5013875200,6207000064,-0.185,0.41,0.80394,0.2969,0.15697,USD,INTU,en-US,US,Equity,Nasdaq Real Time Price,TRUE,HIGH,POST,0.33778784,653.5,2.2000122,-0.030029297,644.46 - 655.11,NasdaqGS,1812269,118.64996,0.22275408,532.65 - 813.7,-162.40002,-0.19958219,1.0095835,1760659200,1755806400,"[{'header': 'Dividend', 'message': 'INTU announced a cash dividend of 1.20 with an ex-date of Oct. 9, 2025', 'meta': {'eventType': 'DIVIDEND', 'dateEpochMs': 1759982400000, 'amount': '1.20'}}]",1758065250,1758052801,NMS,finmb_21171,America/New_York,EDT,-14400000,us_market,FALSE,-0.004610458,651.3,Intuit Inc.,Intuit Inc.,1763668800,1763668800,1755808200,1755808200,TRUE,13.68,22.23,23.17106,28.108337,-73.88641,-0.1018861,-12.463928,-0.018777652,15,0,,TRUE,7.32E+11,,1.6 - Buy,FALSE,Intuit,1.8313,,,,
